-- phpMyAdmin SQL Dump
-- version 4.9.7
-- https://www.phpmyadmin.net/
--
-- Host: localhost:3306
-- Waktu pembuatan: 31 Okt 2022 pada 15.59
-- Versi server: 5.7.40
-- Versi PHP: 7.4.30

SET SQL_MODE = "NO_AUTO_VALUE_ON_ZERO";
SET AUTOCOMMIT = 0;
START TRANSACTION;
SET time_zone = "+00:00";


/*!40101 SET @OLD_CHARACTER_SET_CLIENT=@@CHARACTER_SET_CLIENT */;
/*!40101 SET @OLD_CHARACTER_SET_RESULTS=@@CHARACTER_SET_RESULTS */;
/*!40101 SET @OLD_COLLATION_CONNECTION=@@COLLATION_CONNECTION */;
/*!40101 SET NAMES utf8mb4 */;

--
-- Database: `ppaskaid_aplikasi_ponpes_2022`
--

-- --------------------------------------------------------

--
-- Struktur dari tabel `absens`
--

CREATE TABLE `absens` (
  `id` bigint(20) UNSIGNED NOT NULL,
  `name` varchar(255) COLLATE utf8mb4_unicode_ci NOT NULL,
  `name_wali` varchar(255) COLLATE utf8mb4_unicode_ci NOT NULL,
  `kelas` varchar(255) COLLATE utf8mb4_unicode_ci NOT NULL,
  `alamat` varchar(255) COLLATE utf8mb4_unicode_ci NOT NULL,
  `foto` varchar(255) COLLATE utf8mb4_unicode_ci NOT NULL,
  `created_at` timestamp NULL DEFAULT NULL,
  `updated_at` timestamp NULL DEFAULT NULL
) ENGINE=InnoDB DEFAULT CHARSET=utf8mb4 COLLATE=utf8mb4_unicode_ci;

--
-- Dumping data untuk tabel `absens`
--

INSERT INTO `absens` (`id`, `name`, `name_wali`, `kelas`, `alamat`, `foto`, `created_at`, `updated_at`) VALUES
(1, 'Zidan agiel fariski', 'Rismanto', 'SMK', 'Krasak Jimbaran bandungan', 'foto-absensi/OD9FuqExjrrz3jvahjfI19y1zFq2knwiSrlGevMA.jpg', '2022-07-12 07:25:08', '2022-07-12 07:25:08'),
(2, 'Tazkiyatul Munna', 'Irham said dan khanifah', 'MA', 'Ngadisono Windusari Magelang', 'foto-absensi/84G0iS228HL2QkoZjNjLiz4iZMVuVPYSrEAu3twV.jpg', '2022-07-12 07:27:26', '2022-07-12 07:27:26'),
(3, 'Alfaro ferdinan', 'Paini', 'SMP 2', 'Wonosari 4/179 rt3/rw3', 'foto-absensi/PUG4gxhMKn9JnEMfdBi8CZgNUGWR2O1C2PlUB3dd.jpg', '2022-07-12 07:27:34', '2022-07-12 07:27:34'),
(4, 'A\'thaanii Rahmat', 'Sadali al panio', 'SMK', 'Rt4, rw1, kalidapu, kaliputih, singorojo, kendal, jawa tengah, indonesia', 'foto-absensi/IbOeicDzF9l6ybCEArlbHHJ9pwQMM1XvAI8A2ecv.jpg', '2022-07-12 07:28:08', '2022-07-12 07:28:08'),
(5, 'Bening maulidha', 'Umar khotob', 'SMK', 'Kebogadung', 'foto-absensi/ocfsTowsunGNMkTscjcVq8BXoJ4GEGu96BwciB4z.jpg', '2022-07-12 07:29:11', '2022-07-12 07:29:11'),
(6, 'Naila Nafisa', 'Wahyudi', 'SMP 1', 'Glepung RT 03 RW 09 Kalongan Kecamatan Ungaran Timur Kabupaten Semarang', 'foto-absensi/HsTSJaDNfbf7HGl9DbgDtNBOEN6sIYhczrvNlYPc.jpg', '2022-07-12 07:29:15', '2022-07-12 07:29:15'),
(7, 'Anindya putri rahmawati', 'Istiowati', 'MA', 'jln. Bengkung rt. 06 rw. 01 kebonbatur mranggen demak', 'foto-absensi/Ri0Vpw8LPMiPt0Ekmr3QCFmV1oZ1dfUiDTEDCpeE.webp', '2022-07-12 07:29:21', '2022-07-12 07:29:21'),
(8, 'Arman Hidayat Sobakh', 'Hani Quroisin', 'SMP 1', 'Randugarut RT 4 Rw 2', 'foto-absensi/fkmPROixZtEsJAT9sMztbcsxHd88EJWuSR868tfE.jpg', '2022-07-12 07:29:55', '2022-07-12 07:29:55'),
(9, 'Nadiwa Putri Latisya Azwar', 'Siswa', 'SMP 1', 'DUSUN MASIRAN , RT2/RW2 DESA KALIGADING , BOJA', 'foto-absensi/PuJzgpCgSqhoEz8K5IzFtPO6nGdQEyxZAroGtyZL.webp', '2022-07-12 07:30:00', '2022-07-12 07:30:00'),
(10, 'Fatimata Wildana Auliyaa', 'Maryanto', 'SMP 2', 'Pagersari Rt 05 Rw 02', 'foto-absensi/eT9GnrYQt6fBGjXI6tFT8SOiPRWcWRJs4E0O6xPY.webp', '2022-07-12 07:30:04', '2022-07-12 07:30:04'),
(11, 'Rizky syaputra', 'Joko umaryanto', 'SMK', 'Karangbolo,rt3 rw7, Ungaran barat', 'foto-absensi/Qy5upPc7um6HHzm6HXElcrVr6CFqOh9UFOuw01cX.jpg', '2022-07-12 07:30:04', '2022-07-12 07:30:04'),
(12, 'Nadia puspita sari', 'Akhmad sodiqin', 'SMP 1', 'Temanggung', 'foto-absensi/YoOFJcrhXCNioDCC0B01ELhS8v7hy69456MqLu9T.webp', '2022-07-12 07:30:09', '2022-07-12 07:30:09'),
(13, 'Bambang Setiawan', 'Bapak tasiwan ibu Sumiyati', 'SMP 1', 'Desa Kaliputih kecamatan Singorojo kabupaten Kendal', 'foto-absensi/ZMK8yRly6U1P0EVhJrCB7xyepz80QHUnb7jUmNf3.jpg', '2022-07-12 07:30:29', '2022-07-12 07:30:29'),
(14, 'hafizzah salsabila safitri', 'makiman', 'MTS', 'jalan karang sari rt 10 rw 10 kelurahan wonosari kecamatan ngalian', 'foto-absensi/zKdIYCS83voj0AdZ3Sobmi7WZdCzK2TvYfF1QXzi.jpg', '2022-07-12 07:30:34', '2022-07-12 07:30:34'),
(15, 'Anny zahrotun aulya', 'Japar', 'SMK', 'Wonoplumbon mijen semarang', 'foto-absensi/7FgBdOUqJkd6SkG3Df0CcUVJJ32KXWOKDWiIaRPD.jpg', '2022-07-12 07:30:46', '2022-07-12 07:30:46'),
(16, 'SAHIDTA WAHYU AMELIA', 'Misdin', 'SMP 2', 'Batang', 'foto-absensi/KYCpU7fOBIcRQ91BDQq6A2PEhItJzCEcLWk1tdAC.jpg', '2022-07-12 07:30:55', '2022-07-12 07:30:55'),
(17, 'Lutfiatul Shifa Yafiah', 'Eko Sarjono', 'MA', 'Jl.Brotojoyo barat 4 no 43 RT 04 RW 03', 'foto-absensi/6bPdiNg2HdJrvcull2tUXBV8PTAUPnfA7XQMZtRi.jpg', '2022-07-12 07:30:56', '2022-07-12 07:30:56'),
(18, 'Arifah Keysa Marcasari', 'Cahyono', 'MTS', 'Pandana merdeka rt 4 rw 3 blok h27', 'foto-absensi/0vyIs7Bht9JEO0KtIaA0KeEGkQfU43ErdsVhxIW5.jpg', '2022-07-12 07:30:58', '2022-07-12 07:30:58'),
(19, 'Muhammad Faruq Syabani', 'Zamroni AR', 'SMK', 'kel.jenggot rt02 rw08 kec Pekalongan selatan kota Pekalongan', 'foto-absensi/t4YoUmZ6Ag9R97HqOtIb6Zrv8zn0rMBItTmI9N9v.jpg', '2022-07-12 07:30:58', '2022-07-12 07:30:58'),
(20, 'Eko Rahmad Nur Sholeh', 'Sri Rohmi Suharti', 'SMP 1', 'Jln.Bintan Selatan Rt 1 Rt 6 Gedanganak ,Ungaran Timur', 'foto-absensi/yLGCuyRp77ppLbpPE28fh0br3uDeJOTwUzBWWmiD.jpg', '2022-07-12 07:31:00', '2022-07-12 07:31:00'),
(21, 'Nova ifatun nabila', 'Zaenal Arifin', 'MA', 'Garon 02/01, Candigaron, sumowono, Semarang,jawa tengah, Indonesia,asia tenggara,bumi', 'foto-absensi/aaCHbymTv7WAvbLd3Xki5LYZpkpJ6B9LZi1DeVSR.jpg', '2022-07-12 07:31:21', '2022-07-12 07:31:21'),
(22, 'Dela muarifah', 'Achmad asrori', 'MA', 'Bentur rt 03 rw 05\r\nKel purwosari , kec mijen \r\nKota semarang', 'foto-absensi/ytQA9ZicY3M2jMV7UaUQiDB5p58BBkbrSP7f1vdM.jpg', '2022-07-12 07:31:27', '2022-07-12 07:31:27'),
(23, 'AUDREYA NADILA RIZQI', 'Muhamad widodo', 'SMP 1', 'Lingkungan Lemahbang,RT 03 RW 05', 'foto-absensi/rB1l3xE4cR890XzEIPV0GRVCxWuC1r20npRxcdrG.jpg', '2022-07-12 07:31:32', '2022-07-12 07:31:32'),
(24, 'Syifa fadhilatul khasanah', 'Sufaesol', 'SMP 1', 'Beringin kulon rt5/rw9,ngaliyan semarang', 'foto-absensi/ramd7agp39OHMEWlx5t6ZlWcnFtNhR4vhnFXJmc9.jpg', '2022-07-12 07:31:45', '2022-07-12 07:31:45'),
(25, 'Davasha Afzaal Zaydan Ghani', 'Arif Wibowo, dan Masrifah Afna', 'MA', 'Dusun brayo barat, Kertosari, singorojo, kendal', 'foto-absensi/WsGFpRkcV3cGXmNU53jCYkuXLr7vWstczDVGQxYq.jpg', '2022-07-12 07:31:54', '2022-07-12 07:31:54'),
(26, 'Nabella putri pramesti', 'Nabella putri pramesti', 'SMP 1', 'Kab.semarang kec.bandungan dusun mlilir desa jurang belik', 'foto-absensi/QcbdsUCHGRkQJu6P4ZEx0i2EqS0qwNxFw8XoMASI.png', '2022-07-12 07:31:59', '2022-07-12 07:31:59'),
(27, 'Ulfi Husnun Nisa', 'Joko setiyo', 'SMP 1', 'Macan mati RT 4 RW 2, Klepu,Kec. Pringapus , Kab. Semarang', 'foto-absensi/onidnZyqGvRgHeowdbwBWxHaqMRpjBUABR5aYZgO.jpg', '2022-07-12 07:32:04', '2022-07-12 07:32:04'),
(28, 'ARIN HIYATUL AULIYA', 'KHOLID ASHARI', 'MTS', 'Pulutan lor rt 01 rw 02 kel.pulutan kec.sidorejo kota salatiga', 'foto-absensi/c7trNGJFw5d3wsFckeeB6YdsWodaynqfUbMYEVls.jpg', '2022-07-12 07:32:05', '2022-07-12 07:32:05'),
(29, 'Robiah Ayatul Husna', 'Rizkya Wahyu Tri Rahmawati', 'MTS', 'Jl. Gunung Talang no.6', 'foto-absensi/KSufYVB1Vid9oWoPoIdQdPoKgJoJQRGneWOkO4nt.jpg', '2022-07-12 07:32:10', '2022-07-12 07:32:10'),
(30, 'Muhammad hafidz Hidayatullah', 'Sahuri', 'MTS', 'Putat gede kecamatan Ngampel kabupaten Kendal', 'foto-absensi/Z7D39dQva7toJbmMlkldOfqPwzhsyQ06zmqtVRYb.jpg', '2022-07-12 07:32:11', '2022-07-12 07:32:11'),
(31, 'Nidaa febriani', 'Sukirman', 'MA', 'Ngesrep timur 6 banyumanik semarang', 'foto-absensi/3ts1gr4G6FKsUzKsBtJ8hmVQVa9LpaUUD34S2vJ7.jpg', '2022-07-12 07:32:12', '2022-07-12 07:32:12'),
(32, 'Laila Az-zahra Dwi Nurwita', 'Patno Edi Munarko', 'MTS', 'Jln. Mulawarman timur dlm1 No88', 'foto-absensi/Vn0oDdsO6CmymBqMRjpb9EOCzsffI0Vr5e6r2yrB.jpg', '2022-07-12 07:32:22', '2022-07-12 07:32:22'),
(33, 'SATRIA BINTANG PRASETYO', 'JOKO PRASETYO', 'MTS', 'TAMBAKAN RT 01 RW 07 KELURAHAN KALIGAWE KECAMATAN GAYAMSARI KOTA SEMARANG', 'foto-absensi/K29bc8ZnvKCgbXIeQVfc4d7euzQckPnfdZNtTGZC.jpg', '2022-07-12 07:32:22', '2022-07-12 07:32:22'),
(34, 'Rafi putra maheswara', 'Slamet setiyawan', 'MA', 'Jl.dr ismangil RT6 RW4 bongsari semanarang barat', 'foto-absensi/1alu53E3esQ1mm8oEy9LxIYSAGPoYWEvqrCuvng9.jpg', '2022-07-12 07:32:25', '2022-07-12 07:32:25'),
(35, 'Calysta Az Zahra Putri', 'Rozin zubaedi', 'SMP 2', 'Jln Ngesrep timur 5 dlm 2 no 20B', 'foto-absensi/KzEkLS9s3TEuJrweeuwrWNzZbZVWLdmHzwNPV7um.webp', '2022-07-12 07:32:26', '2022-07-12 07:32:26'),
(36, 'Carisa Salsabila Firdausa', 'Samsun Karmen', 'SMK', 'Desa Kertomulyo Rt 02 Rw 05, Kecamatan Brangsong Kabupaten Kendal', 'foto-absensi/vAqmKjBU6Ck162N8SnQTE5v64AidwkYgdCWaS2i4.jpg', '2022-07-12 07:32:40', '2022-07-12 07:32:40'),
(37, 'Natasya permana Dewi', 'Mimi suratmi', 'SMP 1', 'Sampit Kalimantan tengah', 'foto-absensi/DLODpyYZC8TGVHzo8DhRzbtNM94lXEA1ak82uKLr.jpg', '2022-07-12 07:32:42', '2022-07-12 07:32:42'),
(38, 'Sidna arzika lailan najwa', 'Rohman ariyanto', 'MTS', 'Jetis pakisan RT 2 RW 3 patean kendal', 'foto-absensi/SOBy7pBIi3jys5iv4DB5qmd5Cn6Z9H7rWnB0hPat.webp', '2022-07-12 07:32:45', '2022-07-12 07:32:45'),
(39, 'Baihaqi Charish Maula', 'Juwandi', 'SMP 1', 'Gintungan RT 06 RW 02 gogik Ungaran barat', 'foto-absensi/vRxW2XbFSLBMLLwrZH847nEJoqNwzpUQNZtx27Zj.jpg', '2022-07-12 07:32:51', '2022-07-12 07:32:51'),
(40, 'Arum maysah aristawati', 'Rina Sri lestari', 'SMP 1', 'Tegalsari rt03/rw04', 'foto-absensi/zb5EiDhppndEGClp39xkhfRHemB07u34nTLhSEEN.jpg', '2022-07-12 07:33:00', '2022-07-12 07:33:00'),
(41, 'Zahwa Khaila Azura', 'Sri Rodiyah', 'SMP 2', 'Twelagiri RT 03/RW 01 Pagedongan', 'foto-absensi/g6RqbynhSemDY3Urzf9YqgVI4OkXjldN5Knjx6XI.jpg', '2022-07-12 07:33:11', '2022-07-12 07:33:11'),
(42, 'Alya Syafaqun Nur', 'Rohmi', 'SMP 1', 'Jl.jayanegara RT09 RW 05, Langensari Barat, Ungaran Barat', 'foto-absensi/9YQ4VI0srTxZQ71BYfoyFph1cL0a472iFz7jRQJ7.jpg', '2022-07-12 07:33:12', '2022-07-12 07:33:12'),
(43, 'Nazwa Yustinia Putri', 'Achmad Yusuf , Siti Rokhanah', 'SMK', 'Duwet RT 1/RW 4,Sumberejo,Kaliwungu,Kendal', 'foto-absensi/iyhfbjFowEKggnVCPcbJ0zjb2UW4OyABRhL3fAre.jpg', '2022-07-12 07:33:13', '2022-07-12 07:33:13'),
(44, 'Habibi rohman', 'Siti mucharomah', 'MA', 'Jl singa utara rt/01 rw/04 kalicari pedurungan semarang', 'foto-absensi/tshxuV75Ys4hEYKpKd9XEfeL2K33yKHIGh8YK0oi.jpg', '2022-07-12 07:33:16', '2022-07-12 07:33:16'),
(45, 'Mukhammad abdurrozzaq', 'Kasno', 'SMK', 'Banjaran kesongo tuntang kabupaten Semarang rt 5\r\nrw 8', 'foto-absensi/F3DCd6sILYw143Kt3w0RQpnYL4WEg2x43tOyzKKx.jpg', '2022-07-12 07:33:28', '2022-07-12 07:33:28'),
(46, 'Yusuf javier ozora', 'Samu jaswadi', 'SMP 1', 'Perum gedawang pesona asri blok E-11 RT 4 RW 7', 'foto-absensi/jxEPsrxHFf8UTbSbMNKR7jS25mlB1GSC1r19s9E5.jpg', '2022-07-12 07:33:30', '2022-07-12 07:33:30'),
(47, 'Eviana Tasya Agustin', 'Sri setyowati', 'SMK', 'dusun pancuran RT 04 RW 02 desa Kandangan kec Bawen kabupaten Semarang', 'foto-absensi/v3FAYTmGZh2dJjucXxldsp7cDRPxyyiVCgwdhuIB.jpg', '2022-07-12 07:33:32', '2022-07-12 07:33:32'),
(48, 'Dhavina Adelia Moza', 'Sri Yuni Ati', 'MA', 'Jalan Udowo Timur 6 no 5 \r\nSemarang, Jawa Tengah', 'foto-absensi/5VMUMXsfdDAMMM7uVp9hB6YNZ3drQrhEnckHzj5O.jpg', '2022-07-12 07:33:54', '2022-07-12 07:33:54'),
(49, 'ANANDA RISMAWATI', 'MAESAROH', 'SMK', 'dk. gowok ds. pungangan, limpung,batang', 'foto-absensi/JZ7vaqAQBYhbs2lpFVhwX4GcOTgmgiklN2CmS511.jpg', '2022-07-12 07:33:57', '2022-07-12 07:33:57'),
(50, 'Aurelia Medina Syavira', 'Syahroni', 'SMP 1', 'Tambak Rejo Pondok rt4/rw9 Kaligawe, Semarang', 'foto-absensi/l6WBywUWlBe1VpBDNSc0OkfdKV0Lrf3uMLVt2Oyy.webp', '2022-07-12 07:33:59', '2022-07-12 07:33:59'),
(51, 'Amirul Azka Putri Utomo', 'Sunu Endah Tri Hesti', 'SMP 2', 'Kauman RT 2/3 Limbangan Kendal', 'foto-absensi/gX7zNOt1kMR31QpkuGkaEUArZ8GfAKMzeQgoqGFb.jpg', '2022-07-12 07:34:02', '2022-07-12 07:34:02'),
(52, 'Vani putri ramadani', 'Ari kurniasari', 'MA', 'Banjaran kesongo tuntang\r\nRT : 06\r\nRW : 08', 'foto-absensi/bp8BVyDTGo0m22o76lTHgq7BI6M52Qof2c5Cotdx.webp', '2022-07-12 07:34:06', '2022-07-12 07:34:06'),
(53, 'Izzan Akbar Naufal Hanif', 'M Faiz Kurniawan Hadi', 'SMP 1', 'Perum Rendole Indah Blok F46A RT 07 RW 06 Ds. Muktiharjo Kec. Margorejo Pati', 'foto-absensi/eTVFg6wQZMbekiA2Mm4jCM1bgZNdwrrC6sfyTLmk.png', '2022-07-12 07:34:15', '2022-07-12 07:34:15'),
(54, 'Assyifa Ramadania Mukti', 'Widati', 'SMP 2', 'jl borobudur VI,rt 05 rw Xll, kelurahan kembangarum ,kec. Semarang Barat, kota semarang', 'foto-absensi/mhJMKT9Zn1daqvBcNCbyBqfayhiQPJlUp7Q6P6Gp.jpg', '2022-07-12 07:34:26', '2022-07-12 07:34:26'),
(55, 'Nadhif zidane adicandra', 'Ahmad ansori', 'SMK', 'Watusari rt01/06,patemon,gunung pati,semarang', 'foto-absensi/mmtHfZWfAfIWd2PLI34hyqJLosIs5qYDJMz0Wxez.jpg', '2022-07-12 07:34:31', '2022-07-12 07:34:31'),
(56, 'ZAHRATUS SYITA SASKIYA', 'Susi Handayani', 'SMP 1', 'Karang Anyar RT 01 RW 13 Muktiharjo kidul Semarang', 'foto-absensi/WNA2DyG6ubFXE7jRphWPgPavEL0DEwgs7MzFnT3E.jpg', '2022-07-12 07:34:40', '2022-07-12 07:34:40'),
(57, 'Alysa Vanessiansyah Saputri', 'Atika', 'SMP 1', 'Langensari RT 10 RW 05, Ungaran Barat, Kabupaten Semarang', 'foto-absensi/ZUxewmv3eFakaV1gLRBzLeCK59Gsae3YzAe1exEm.jpg', '2022-07-12 07:35:01', '2022-07-12 07:35:01'),
(58, 'Firstyane anggun selika', 'Bpk.aris nugroho dan ibu zumroah', 'MA', 'Bergas kidul 04/02 kec. Bergas kab. Semarang', 'foto-absensi/LPyhFtdMUIluqTj7WTk5mDkb5sfIlrCfeFt20B4d.webp', '2022-07-12 07:35:02', '2022-07-12 07:35:02'),
(59, 'Muhamad romadhoni', 'Suyartini', 'SMK', 'Kendal, singorojo, kertosari, brati barat', 'foto-absensi/RIt2ce39ea8yiM4lzEgofbzmN9c1QhmbNYBoCi3L.jpg', '2022-07-12 07:35:02', '2022-07-12 07:35:02'),
(60, 'Ghipa Sheno Apriama', 'Sugianto', 'SMK', 'Jl Bangetayu Wetan Rt 8/Rw 1\r\nGenuk Semarang', 'foto-absensi/wDpShqvzZIXVgF4TILdwXQqll2YlYwnyNdil0aZ0.webp', '2022-07-12 07:35:15', '2022-07-12 07:35:15'),
(61, 'Zidan putra cahyono', 'Herry cahyono', 'SMP 1', 'Bukit Leyangan damai RT 1 RW 9', 'foto-absensi/StGvw8XL17iSnq4ciPZbJqtJDbUgdYQAZGpsOafL.jpg', '2022-07-12 07:35:18', '2022-07-12 07:35:18'),
(62, 'Khansa Tabita sakhi', 'Elok Ulin Nuha', 'MTS', 'jl.flores, kalisari 2, rt 2/rw 5, desa jombor, kec.Tuntang, kab. Semarang', 'foto-absensi/usKqL5PM8t6DZxjqmzGVKrQGq2FXHwQ6UQWrIswF.jpg', '2022-07-12 07:35:21', '2022-07-12 07:35:21'),
(63, 'Ardi Brilliant Martaretta Ptadani', 'Sumardi', 'MTS', 'Perum puri pudak payung asri Blok H No.76  Kel. Pudak Payung Kec. Banyumanik Kota Semarang Jatreng', 'foto-absensi/2sOBazY1J43ytdEKb521maOipZmWRJJIDrT86mCR.jpg', '2022-07-12 07:35:37', '2022-07-12 07:35:37'),
(64, 'Amanda Putri fajarina', 'Solihin', 'SMP 1', 'Karangsari rt03 RW 06 sumurejo gunungpati', 'foto-absensi/RsJ2Dd32arDkLEJfhzubvgfZcNtDGRgg7q8EG2Dl.jpg', '2022-07-12 07:35:44', '2022-07-12 07:35:44'),
(65, 'M.miftaachul falaach', 'Nurrofiq/endang setyowati', 'MTS', 'Dsn Lendoh 001/003 Ds Leban Kec. Boja kab. Kendal', 'foto-absensi/VvibolHqlzCPHCz9mG8awo8HAAR8YaTkZw9WAwKt.jpg', '2022-07-12 07:35:51', '2022-07-12 07:35:51'),
(66, 'Arif Surya Atmaja', 'Hadi Nuryanto', 'SMP 1', 'Kelurahan Ngempon RT 02 RW 06 Kecamatan Bergas Kab. Semarang', 'foto-absensi/8qCbqrN1fRLZLF96iBy2uc15xIyV2VLXja9ZztgC.jpg', '2022-07-12 07:35:54', '2022-07-12 07:35:54'),
(67, 'Latifatul Maela', 'Bp. Kiyar', 'MA', 'Desa kliris, kecamatan boja, kabupaten kendal', 'foto-absensi/By5ERYjeHRdMNAv7kO9FIoTpPappKOrWRiISJQWu.jpg', '2022-07-12 07:35:59', '2022-07-12 07:35:59'),
(68, 'Febriana alya syarifah', 'Sholikin', 'SMP 1', 'Lembah sari RT 9 RW 10, ngaliyan, semarang', 'foto-absensi/vaDdhFFZKK7pCJ6cgdu9SQSv2WFri4s6btEhNY7I.jpg', '2022-07-12 07:36:00', '2022-07-12 07:36:00'),
(69, 'Vicky Dian Nugraha', 'Endang Tri Kusnanik', 'MA', 'Jln.Ahmad Yani,RT20/RW01, Desa Bumi Harjo, Kec.Kumai,Kab.Kotawaringin Barat, Kalimantan Tengah', 'foto-absensi/C7Dt2mNNe1hTDkuqeIZ3zO7iS8Sk48B8seLyfnUx.jpg', '2022-07-12 07:36:00', '2022-07-12 07:36:00'),
(70, 'Syafira Asha Rahma Khalyani', 'Rachman Z', 'MTS', 'Semarang', 'foto-absensi/sGwBFJlFHXoGiUt5ZZLANgRIw1nSnVQ4G92VH9BB.jpg', '2022-07-12 07:36:07', '2022-07-12 07:36:07'),
(71, 'M Faqih mubarok', 'Nas\'udin', 'MTS', 'Brayo Timur - Kertosari', 'foto-absensi/9Gof5866euQcSyAPXkRTDLmkvLtyJgPbcTmRev4o.jpg', '2022-07-12 07:36:11', '2022-07-12 07:36:11'),
(72, 'Alifa Syafaatul Udzma', 'Ariyadi,S.Pd.I', 'MA', 'Kenangan,bergas Kidul,rt 1 rw 7,kec.Bergas kab.Semarang', 'foto-absensi/vB5hKpZfycDS2ub6evUrFnja22lmeA4EtuF3YafC.jpg', '2022-07-12 07:36:12', '2022-07-12 07:36:12'),
(73, 'Naora Syifana Aulia Mahiaraya', 'Yani Dwi Prayitno', 'SMP 1', 'Lingk. Sidorejo Rt 04 Rw 09 Kel. Bergaslor Kec. Bergas Kab. Semarang', 'foto-absensi/jsC57TF0tzy6ci6SWkPX2VbK8rXyEQpDa85V7wzQ.jpg', '2022-07-12 07:36:17', '2022-07-12 07:36:17'),
(74, 'Rossalin aisha ativa', 'Hesti pratiwi', 'SMK', 'Karanggeneg,kec gunung pati', 'foto-absensi/d9IUvepgbzzSukIlzINMiltlzJQfiTWzwvK6PPNq.png', '2022-07-12 07:36:36', '2022-07-12 07:36:36'),
(75, 'Farizal Dwi Saputra', 'Endah lestari', 'SMP 2', 'Karanggeneng RT 1/RW 1 \r\nsumurrejo gunung Pati', 'foto-absensi/z0jFiHrrgps9ninbh7QBtYpSjQfi0dxIkqWAdlvR.jpg', '2022-07-12 07:36:37', '2022-07-12 07:36:37'),
(76, 'ghaitsa hasna dien', 'suwarno', 'SMP 1', 'jalan condrokusuma 3 rt 3rw 3', 'foto-absensi/TBfis0YaK4tF3NdkmOUPkiVNWNOnjF1WRtQYjQXS.jpg', '2022-07-12 07:36:39', '2022-07-12 07:36:39'),
(77, 'Nadin Inna fauziah', 'Ali Ridla', 'SMP 1', 'Aspol Utara Blok D Rt 04 Rw 06 Purwodinatan Semarang Tengah Kota Semarang', 'foto-absensi/zYO3hPJtGSWvnV0a8K0lda1DJH8vkwOQS6sFXfMR.jpg', '2022-07-12 07:36:45', '2022-07-12 07:36:45'),
(78, 'Eva nofia Ramadani', 'Siti fatonah', 'SMK', 'desa keseneng,kec.sumowono,kabupaten semarang', 'foto-absensi/gINWOHh9Zi9DXhqmObyV7r31WfqNaIUlPeKUNYI0.jpg', '2022-07-12 07:36:45', '2022-07-12 07:36:45'),
(79, 'muhammad arkan hasnawi', 'mulyadi', 'SMP 1', 'desa kalirejo,kec kangkung kendal', 'foto-absensi/ZCiF1Ou3jTu2A6qDLubLQzej1ApolotGlpH8l65R.jpg', '2022-07-12 07:36:49', '2022-07-12 07:36:49'),
(80, 'Marsha kalyca fakhrunnisa', 'Lyndha wati', 'MA', 'Rt: 10/rw: 2, dsn kerajan wringin putih, kec bergas, kab semarang', 'foto-absensi/P7IlI8VsY8JYKcDOeOSRgKgZn8q3NVwfW7MCs8Mo.jpg', '2022-07-12 07:36:58', '2022-07-12 07:36:58'),
(81, 'Devangga Manggala Wijaya Sukma', 'Bunga Kalpika Surya Devki', 'SMP 1', 'Pringapus rt5 rw1, kec. Pringapus', 'foto-absensi/FLKBI21KnFvdP4dSPllX87ZVFPbaUJXNzxjCXmqY.jpg', '2022-07-12 07:36:59', '2022-07-12 07:36:59'),
(82, 'Cinta Maularida', 'Moch Ridwan', 'SMP 1', 'Jl.Brotojoyo tengah 2 no.63 RT4 RW 3 kelurahan plombokan KEC.Semarang Utara Kabupaten Semarang', 'foto-absensi/GmwrqtGE2i1jbIvzBSkcgeIBTCqcSU390Qzn7FzD.jpg', '2022-07-12 07:37:02', '2022-07-12 07:37:02'),
(83, 'Muhammad abid aufa', 'Jazilatun Nafisah', 'MA', 'Jl. Jatikusuman Raya RT 06 RW 03, Mranggen, Demak', 'foto-absensi/8gQw4HpRMukd1GkyrS1Z1HjTRdfVCOIee0uSnyYN.jpg', '2022-07-12 07:37:05', '2022-07-12 07:37:05'),
(84, 'Najwa adzro cetta asfasia', 'Niko Febriansyah', 'SMP 2', 'Perum bancar cluster 3 blok B.10 kelurahan bebengan kecamatan boja kabupaten Kendal Jawa tengah', 'foto-absensi/ZujmP1xnphurJtJvQG6wuqly3duwJADxLc1EbgxA.jpg', '2022-07-12 07:37:09', '2022-07-12 07:37:09'),
(85, 'Alfareza Yodan Apriando', 'Umari', 'SMP 1', 'Jl.sentyakibaru 3 no 6', 'foto-absensi/MQ0P69L2Y6sqa1tW16A5pAiJcB1i1Zv7d161qOVD.jpg', '2022-07-12 07:37:17', '2022-07-12 07:37:17'),
(86, 'Jihan naila labiba', 'M zainudin', 'MA', 'Jl pemuda gayudan 2 proyo. Selatan batang', 'foto-absensi/Um4g6VJySFYo9ujXQCBNmck3HGNhjKLNrMvPyyfw.jpg', '2022-07-12 07:37:32', '2022-07-12 07:37:32'),
(87, 'Zakariya nawawi', 'Riza nawawi', 'MTS', 'Ds. Karang jati boja kendal rt 04/04', 'foto-absensi/j62KdmQTBiFW2qEEmRT8x77XY49n4LzmGKJ5t1Pz.jpg', '2022-07-12 07:37:46', '2022-07-12 07:37:46'),
(88, 'ARGA KUMALA REKSHA', 'SUMPENO', 'SMP 1', 'Dsn. Srumbung Gunung Rt02/Rw01, Desa Poncoruso, Kec. Bawen, Kab. Semarang, JAWA TENGAH', 'foto-absensi/OQRYqpPlxMAnsI1gcO0x76WKOTapeeJshyUBFkEF.jpg', '2022-07-12 07:37:48', '2022-07-12 07:37:48'),
(89, 'Muhamad Dzikriy Ar Rouf', 'M Ircham/anjani', 'MA', 'Tegalsari RT5 RW8, Bergas Lor, Bergas, Kab Semarang', 'foto-absensi/bRnmE35bhK6vGZWKcVaOS31QB3MoiHsXUOWtV7tj.jpg', '2022-07-12 07:37:49', '2022-07-12 07:37:49'),
(90, 'Syifa Adinda Dwi Putri', 'Susmayawati', 'SMP 2', 'Jln.rejosari Gumuk B Rt 06 Rw 11', 'foto-absensi/aGhLepO2wtNwH3dtIB5ikhDI451Y5eIw1kSdEcIA.jpg', '2022-07-12 07:37:52', '2022-07-12 07:37:52'),
(91, 'Destian Rifqi Zaidaan', 'Santoso/Yatinah', 'SMP 1', 'Kintelan kidul RT  02 RW 02 Candirejo Tuntang \r\n Semarang', 'foto-absensi/p2Gtbyw7QSssKnT6JsTsnOKuAq1zHPFfcsCyIjc0.jpg', '2022-07-12 07:38:03', '2022-07-12 07:38:03'),
(92, 'Syaqilla azzahra', 'Erlin Mihayati', 'SMP 1', 'Kalipancur rt8 rw3\r\nKel.bambankerep, Ngaliyan semarang', 'foto-absensi/BTd0pybjTnpSJOUSKfcqYHwPPlJtpdXqAIm0xsNM.jpg', '2022-07-12 07:38:07', '2022-07-12 07:38:07'),
(94, 'Ikhwan Nuhgroho', 'Suparno', 'SMP 1', 'Kaligangsa tegal kecamatan Margadana', 'foto-absensi/BrwUubyj0Snc3OXlO1lqbebHwiGXqF7A4iRliYex.jpg', '2022-07-12 07:38:22', '2022-07-12 07:38:22'),
(95, 'Raffi Oktavia Kusumawardani', 'Murofik', 'SMP 1', 'jln.lingga timur rt7/6 gedanganak,ungaran timur,kab.semarang', 'foto-absensi/7V4CldRAIW1bTzCBzugzwdzniCQfSuiu1g6MEkkH.jpg', '2022-07-12 07:38:25', '2022-07-12 07:38:25'),
(96, 'Aisyah Eka Putri Ardhiyanto', 'Yudhi Ardhiyanto', 'MTS', 'Jalan Murai 1 Blok J-29\r\nPuri Delta Asri V Tahap 1\r\nLeyangan, Ungaran Timur\r\nKab Semarang', 'foto-absensi/YM87ILimacRzs6tKWmkizWle12qCdjjguWLNDlAp.jpg', '2022-07-12 07:38:26', '2022-07-12 07:38:26'),
(97, 'Rizki Ragil Saputra', 'Endah lestari', 'SMP 2', 'Karanggeneng RT 1/RW 1\r\nsumurrejo gunung Pati', 'foto-absensi/8e6dFIdhMc9iSYnTPRLyNUfhZjS1XB8QnPDLxLrv.jpg', '2022-07-12 07:38:26', '2022-07-12 07:38:26'),
(98, 'Hikmatul fauziyah', 'kastutik', 'MTS', 'JL.kalialang lama ll no.18 semarang kecamatan Gunungpati kelurahan sukorejo', 'foto-absensi/RshwZROupNuZXMUsNvsqiyUDwpyt8cYuJzPTVdyv.jpg', '2022-07-12 07:38:38', '2022-07-12 07:38:38'),
(99, 'Nura Sania Bariroh', 'Siti Nur Hamidah', 'MTS', 'Harjosari rt01 rw07, Bawen, Kab.Semarang', 'foto-absensi/qgElfOkweq8tSmBjiIWEyr91icyfIus0eE3PcLJ8.jpg', '2022-07-12 07:38:46', '2022-07-12 07:38:46'),
(100, 'Miftah Fatihah Azzahra', 'Retno Watini', 'SMP 1', 'Meteseh, Boja\r\nMaaf anak sedang di rumah Semarang, jd zoom nya terpisah gak bs foto bareng,  tp Mifta ikutan nyimak', 'foto-absensi/fynSSCMi6lJVUPoEBHwLrrQM96nldFzhCxy4btNo.jpg', '2022-07-12 07:38:50', '2022-07-12 07:38:50'),
(101, 'Wahyu Indah Pratiwi', 'Aditya Nugrahanto', 'SMP 2', 'Kenangkan rt.06 rw.07 kel.bergas kidul kec.bergas kab.semarang', 'foto-absensi/dWc3VuekIY4oceEDJdwGaBmQsD7d1n60vtPIWxmh.webp', '2022-07-12 07:38:51', '2022-07-12 07:38:51'),
(102, 'Nazwa rizki azariya', 'Zainal Arifin', 'SMP 1', 'JL.gondosari 2 RT 01 RW 04 Gondoriyo Ngaliyan Semarang , Jawa tengah,kota Semarang, Ngaliyan', 'foto-absensi/W2qZIRFTZxmEMeA7c3peMhfJiq4ItIzIci95FeFe.jpg', '2022-07-12 07:38:59', '2022-07-12 07:38:59'),
(103, 'Madesta Arya Yudhistira', 'Umi Shofiatun', 'SMP 2', 'Winongsari Rt 5/Rw 5 Ngablak Candirejo Ungaran Barat Kab.Semarang', 'foto-absensi/v0xjMgt2Cg3WjSrFVJ0zMpnWjMIkk8bJKsSJe94a.jpg', '2022-07-12 07:39:05', '2022-07-12 07:39:05'),
(104, 'Salsabila ni\'mah Kamaliyya', 'Nur Laila', 'MA', 'pekalongan', 'foto-absensi/qwVl8TzdHNhtd7n8aHjzojhY3ZCrLmDiGH2lSfyd.jpg', '2022-07-12 07:39:12', '2022-07-12 07:39:12'),
(105, 'Ananda Tegar pradika maylano', 'Suprianto', 'SMK', 'Perum griya beringin asri blok f no 81 RT/RW 01/13 Wonogiri, ngaliyan, semarang', 'foto-absensi/FkPFDakOZ20umMQZG2v6fxnIyEODlrJD15eUkYqH.jpg', '2022-07-12 07:39:15', '2022-07-12 07:39:15'),
(106, 'Jesica fresilia devanda', 'minanto', 'SMP 1', 'Kebonan rt:02 rw:05 Jatijajar,bergas', 'foto-absensi/m2pLVqlNqV03NOwxjUH4FLqbuYEDaJNaYtvhxJkt.webp', '2022-07-12 07:39:16', '2022-07-12 07:39:16'),
(107, 'Achsan Nur Rosyid', 'Amrul Bar', 'MTS', 'kel. Slerok Kota Tegal', 'foto-absensi/Lv5b4rBfXL26L4FPgP3K24eOBnbPubl7KuVBeWNz.jpg', '2022-07-12 07:39:20', '2022-07-12 07:39:20'),
(108, 'Muhammad Hanif Rudiansyah', 'Ani susanti', 'SMP 1', 'Jl.Bayem VII RT.12 / VII Kel.Sendangguwo Kec.Tembalang\r\nSemarang', 'foto-absensi/FUGNDMfoRD9c2cipshvSdbrLBiXKjB0f4ReA4yEv.jpg', '2022-07-12 07:39:25', '2022-07-12 07:39:25'),
(109, 'anisa aulia zulva ramadhani', 'ary yusmawan', 'SMP 2', 'rekesan RT:03 RW:04 kalirejo ungaran timur', 'foto-absensi/zg3cnpacrlhT8rSH7cneObfuxCH0TSd5QZbU0wQB.webp', '2022-07-12 07:39:28', '2022-07-12 07:39:28'),
(110, 'Raffasya Naufal Nur Ramadhan', 'Lalita sukmawati', 'SMP 2', 'Jl. Sendang indah timur rt. 01/02 no. 36 semarang', 'foto-absensi/55yrLEderyF0w5UYzM7M0HEguU8ZJIWh7ody0Ovz.jpg', '2022-07-12 07:39:45', '2022-07-12 07:39:45'),
(111, 'Nashava Kinaura', 'Wahyudi', 'SMP 1', 'Jamus karang sambung rt10 rw03', 'foto-absensi/Ewf25sA7IXUBqu1kD7WZZiKURJhTO17RkIEKCxIG.jpg', '2022-07-12 07:39:46', '2022-07-12 07:39:46'),
(112, 'Abror galih salim', 'Kun salamah', 'SMP 2', 'Jln ciliwung 2 no. 673', 'foto-absensi/BTxRmUIMlNo3Pq811CL7sz0vnrh84jkJtQUP2G4m.jpg', '2022-07-12 07:40:00', '2022-07-12 07:40:00'),
(113, 'Azahra Zaeshania Anjani', 'Umiyati', 'MA', 'Ds Tabet RT 1 RW 4 limbangan boja Kendal', 'foto-absensi/s0oWRiJ1xoFvFyybaKCjjOtTd4WVTJKg0BC1DVxo.jpg', '2022-07-12 07:40:06', '2022-07-12 07:40:06'),
(114, 'Kafka maulana rayhan', 'Siswadi', 'MA', 'Sadeng, gunung pati, semarang', 'foto-absensi/5RI7W7mc0IqDGVh2xX6gTjZe7vCyttSVpYRIlG11.jpg', '2022-07-12 07:40:06', '2022-07-12 07:40:06'),
(115, 'Iqbal Ardeanto Putra Setiawan', 'Dely Rahmawaty', 'SMP 2', 'Kalbar', 'foto-absensi/pL8EBI9dvaCjs5LLH0ZXLjgV9rWSVDua1NtN2j2e.jpg', '2022-07-12 07:40:13', '2022-07-12 07:40:13'),
(116, 'Rizky amelia ramadhani', 'Bambang sarito', 'SMP 1', 'Lingk. Harjosari rt/rw:04/07, Kel.Harjosari, Kec. Bawen, Kab. Semarang', 'foto-absensi/nqk28VEACv855Sh0H4hQSymB0oeuAoMhRs8T01vx.jpg', '2022-07-12 07:40:33', '2022-07-12 07:40:33'),
(117, 'Nuril maulida', 'Nur amalia', 'SMP 1', 'Kendal, Rowosari, tanjung sari rt1/2', 'foto-absensi/Cy9pfZZtVevZYI5J6Z9iCd94DmcsiT21H8SGnKRT.webp', '2022-07-12 07:40:36', '2022-07-12 07:40:36'),
(118, 'Shilla Nadifa', 'Susanto', 'MTS', 'Leyangan RT03 RW01, ungaran timur, kab semarang', 'foto-absensi/NxNXeNrVIgNAOXdjibhwWbaaXFJVaUZpOriRf90P.jpg', '2022-07-12 07:40:41', '2022-07-12 07:40:41'),
(119, 'Nabiilah aqiilah rismawati', 'Mualim', 'SMP 1', 'Dk.jatibarang Rt01/Rw01 kec.mijen Semarang', 'foto-absensi/HV3mbtZNSiCbGEO2ybh6Kxwti74dJBJmGUiEcde8.jpg', '2022-07-12 07:40:41', '2022-07-12 07:40:41'),
(120, 'Zulfa saniyatur rosyidah', 'Nurkholis', 'MA', 'Gedongan ngesrepbalong limbangan kendal', 'foto-absensi/GNMiF2Fjf5TrQ961VWV8I49GFRxLc5FWgzvmJalO.jpg', '2022-07-12 07:40:46', '2022-07-12 07:40:46'),
(121, 'Zahra arvita putri', 'Zahra arvita putri', 'MTS', 'kp.karang asem RT.02/RW.009 kel.mlati baru kota Semarang Jawa Tengah.', 'foto-absensi/r2lHdNyVyA5ejvdOMo2f1QqRuHXjo1ztsfMUbChg.jpg', '2022-07-12 07:40:56', '2022-07-12 07:40:56'),
(122, 'Keisha ivana latief', 'Latip', 'MTS', 'Dukuh sidomulyo RT.17 desa.kedawung kec.mondokan kab.sragen', 'foto-absensi/u08F0JeERTXnCBoYeBpVVYk7eNn8xRLHT0mlOThY.jpg', '2022-07-12 07:41:21', '2022-07-12 07:41:21'),
(123, 'Eka Fajarina Az-Zahra', 'Kuwat Susilo', 'MTS', 'Desa bukit jaya kab Lamandau Kalimantan tengah', 'foto-absensi/PiXlwlt0p57tzaM122HASvmtKh5BXrBLRHskejZM.jpg', '2022-07-12 07:41:43', '2022-07-12 07:41:43'),
(124, 'Arina Ifa Manasikana', 'M.Subhan', 'SMK', 'rt.05/rw.04, Dudak, Sidodadi, Mijen, Semarang, Jawa tengah.', 'foto-absensi/MzjXYipyzkPrD5tigUePIav7FD3D1bI0pGe9Q2bQ.jpg', '2022-07-12 07:41:47', '2022-07-12 07:41:47'),
(125, 'Sansa Adhwaa Maulida', 'Sarwono Budiyanto', 'SMP 1', 'Aspol Kabluk Gayamsari', 'foto-absensi/CmVFR2uwDEl8xY3zGNXtdKjjHStrcUUAP1NFOvdl.jpg', '2022-07-12 07:41:47', '2022-07-12 07:41:47'),
(126, 'Iqbal Arfa Adliansyah', 'Djarot Budianto', 'SMP 1', 'Leyangan Damai RT 3 RW 8 Leyangan. Ungaran Timur, Kab Semarang', 'foto-absensi/LqhNtblUHXK2yhqCyEmF4M3maB6AFYTOTZYjfABu.jpg', '2022-07-12 07:41:54', '2022-07-12 07:41:54'),
(127, 'Muhammad Rafi Wildan Hamid', 'Parmadi', 'SMP 1', 'Jl kenanga raya rt 06 rw 02 Gedawang Banyumanik Semarang', 'foto-absensi/Xj8yGu7HJWhF1YTrWny6U6ZDByM9SU0DyxKjEvXc.jpg', '2022-07-12 07:42:09', '2022-07-12 07:42:09'),
(128, 'Asyam Fatah Mubarok', 'Retno Tri Handayani', 'SMP 1', 'Jalan Condrokusumo 3 RT 03 RW 03', 'foto-absensi/djpQrGkajji6nYZxxDehDh5tENI6ReDXIKvWnhH3.jpg', '2022-07-12 07:42:11', '2022-07-12 07:42:11'),
(129, 'Ahmadana Eleventio Zani I.K', 'Ana Wahyuni', 'SMK', 'Jl. Panda Raya 67 E Semarang', 'foto-absensi/PuP4UEpYI23kkCc5dE19EEgsuZ8xZLmaNCrjexxQ.jpg', '2022-07-12 07:42:32', '2022-07-12 07:42:32'),
(130, 'TRISTA AGUS SAFIRA', 'Erni eni nainia', 'SMP 1', 'Perumahan taman Langensari indah Ungaran barat RT. 08 RW. 04', 'foto-absensi/iNfaidNroXu5kNP2k3GTXNRAlFTmN8mDGjricGGP.jpg', '2022-07-12 07:42:47', '2022-07-12 07:42:47'),
(131, 'Vira putri ramadani', 'Ari kurniasari', 'MA', 'banjaran, kesongo', 'foto-absensi/lQaRJTU9AGNXu3FysxzKSp3mvEUuPXuNQzvpDhDR.jpg', '2022-07-12 07:42:49', '2022-07-12 07:42:49'),
(132, 'RAFKA RADITIA FEBRIAN', 'Bapak mari ibu trinah', 'SMP 1', 'desa keji rt 01/rw 01 kec.ungaran barat. Kab. Semarang', 'foto-absensi/TEfkDF94M8YAIT0U2GCRiAHmE5YVgz2ggLeo1EvH.jpg', '2022-07-12 07:43:20', '2022-07-12 07:43:20'),
(133, 'Adinda Tri Wahyu Ningsih', 'Kustadi', 'SMP 1', 'Jln taman srinindito karang Jangkang RT 9 RW 4', 'foto-absensi/vGkcm21XM3yiDcZmGAepVzn1wOPYsdZoCvJc1jpC.png', '2022-07-12 07:43:22', '2022-07-12 07:43:22'),
(134, 'Wahda zahra alina', 'Edy wahono', 'SMP 1', 'Terboyo kulon rt 03/01 kec Genuk semarang', 'foto-absensi/nXU4Kh3mpfhq6i01JUHgcK2zHhze0WqvPVB1Ewqs.jpg', '2022-07-12 07:44:08', '2022-07-12 07:44:08'),
(135, 'Epsyen Takwanawa', 'Imam yunianto', 'MA', 'Semarang, Semarang barat, pedurungan, jalan singa', 'foto-absensi/KepnudgJDj4gBDcKrGrAoyjA7LZy84B6Y6BJgX7g.webp', '2022-07-12 07:44:25', '2022-07-12 07:44:25'),
(136, 'Cinta ashlahayu rahmania', 'Saheri', 'SMK', 'Puri delta asri 3 blok u.3 cangkiran', 'foto-absensi/PJTk1JhQ2hSykHYz7LyDVSSbPE3pxdG1trQYdFj9.jpg', '2022-07-12 07:44:36', '2022-07-12 07:44:36'),
(137, 'Oktaviona fitriani', 'Slamet arifin', 'SMK', 'Dsn bulu, Kelurahan kandangan, Kec bawen', 'foto-absensi/M55Xni3FynW10uRYfxWmoXQZti6GkCtBOav6n8jn.jpg', '2022-07-12 07:44:45', '2022-07-12 07:44:45'),
(138, 'Siskha agustin ramadhani', 'Bpk.fitri anto', 'SMP 1', 'Jl.pucung rt 03/01 Bambankerep ngaliyan semarang.', 'foto-absensi/yqcAxsu9unLX0JHH51er91XWsQtejnDQK8E0c4q1.jpg', '2022-07-12 07:44:48', '2022-07-12 07:44:48'),
(139, 'Kaisya Kamila', 'Mahmudi / Murodah', 'MTS', 'Jln. Karya bakti Gg.5 Sunan giri, Medono-Pekalongan', 'foto-absensi/szEfIvDxk6CGiaRa7SWwGFQKeOD2C8BGPtzksewo.jpg', '2022-07-12 07:45:09', '2022-07-12 07:45:09'),
(140, 'Ghani yazid khairy', 'JUNAEDI', 'SMP 1', 'JOMBOR, RT 01/ RW 02, DUWET, BAKI, SUKOHARJO', 'foto-absensi/0UXf2dy3TDVqnVrAbWgiPJRb736iZ12fUXY0OeGz.jpg', '2022-07-12 07:45:14', '2022-07-12 07:45:14'),
(141, 'ZALFA AULIA MARSYA', 'FAIK KUSUMA. R', 'SMP 1', 'DS.TUNGGULSARI RT 2 RW 3 BRANGSONG KENDAL', 'foto-absensi/jZkpHsk7XtY7TyBpzAMTbb1WLweOzYXojeXA05zO.jpg', '2022-07-12 07:45:17', '2022-07-12 07:45:17'),
(142, 'Fathiya Maulida WIles Pangesti', 'Lestiyono', 'SMP 1', 'Ngesrep timur 3 , no 43 , rt.09/ rw.01\r\nSumur boto , banyumanik', 'foto-absensi/KhgFHpgsOxBv7mtWSRdyfO0InOmVbXZ8bFjBrPPd.jpg', '2022-07-12 07:45:18', '2022-07-12 07:45:18'),
(143, 'Siti Rohani', 'Taufik Hidayat', 'MA', 'Jl. Tanjungsari, Rt.01/Rw.02, Kel. Sumurboto, Kec. Banyumanik, Semarang', 'foto-absensi/kOCLvzgaBfLnBscd14LgGEq3mi0anCntyfQyeUHY.jpg', '2022-07-12 07:45:22', '2022-07-12 07:45:22'),
(144, 'Aqila Nesya Ardhiani', 'Yoan Ardhi', 'SMP 2', 'Ds.Purwokerto Rt.1 Rw.1 Kec.Brangsong Kab.Kendal', 'foto-absensi/aHt3ATeLR6UX3loOUOqlxX0uDR7GXKcuhH8CSfk3.jpg', '2022-07-12 07:45:29', '2022-07-12 07:45:29'),
(145, 'Adrean Akhmal Siswanto', 'Endang Feriyanti', 'MTS', 'Delikrejo rt 05 rw 11 kelurahan Tandang kecamatan Tembalang, Semarang', 'foto-absensi/NK9fIQZyRpWcgHRrf4P84J1Fa7io39UgS5KBbGpF.jpg', '2022-07-12 07:45:48', '2022-07-12 07:45:48'),
(146, 'Mabel Qurrota A\'yunin Arta', 'Arifin', 'SMP 2', 'Dewi Sartika Barat no 45 Rt 07 Rw 03 Semarang', 'foto-absensi/hgo4CQJ38rx4I1MBQWsXjYGlXTq7x3YqH82dNUUt.jpg', '2022-07-12 07:46:18', '2022-07-12 07:46:18'),
(147, 'Ela naimatus Sholihah', 'Sholekhan', 'SMP 1', 'Dsn.Tengaran RT/RW 01/08 Desa.Duren KEC.Bandungan KAB.Semarang', 'foto-absensi/jBRmvQ51Skp5fubtzWa4gYSv4TxOz50xWcyRhhqY.jpg', '2022-07-12 07:46:30', '2022-07-12 07:46:30'),
(148, 'RAIHAN AUREOLE PURNOMO', 'ADI PURNOMO', 'SMP 1', 'Dsn.Prampelan rt 02/05,Ds.Mlilir,,Kec .Bandungan,Kab.Semarang,Jawa Tengah', 'foto-absensi/uWC08YO95eDjYs55fO04l5UBuoOXgBGqADEfeQj5.jpg', '2022-07-12 07:46:40', '2022-07-12 07:46:40'),
(149, 'Anisa Shaskia Jelita', 'Ades Supriyanto', 'SMK', 'Desa Sungai Bengkuang kec. Pangkalan Banteng, kab. Kotawaringin Barat Kalimantan Tengah', 'foto-absensi/OpRMvEruYjHepGOxjgPtUZpbuOYANm0xQ8NH1Up0.webp', '2022-07-12 07:47:32', '2022-07-12 07:47:32'),
(150, 'Al Zahra Fathika Ayulandara', 'Ida Irasanti', 'SMK', 'Nambangan RT 2 RW 20\r\nRejowinangun Utara\r\nMagelang Tengah\r\nMagelang', 'foto-absensi/tPq7l6kZmzjvtOOH3pXArI1xUkikyak8JFEEf22U.jpg', '2022-07-12 07:47:40', '2022-07-12 07:47:40'),
(151, 'Ahmad Nur Salim', 'SLAMET', 'SMK', 'brangsong-kendal-jawa tengah', 'foto-absensi/3PI4XRzuXLiaJVJk3qIeJY5ubBAHgtZkGneZLuWt.jpg', '2022-07-12 07:47:59', '2022-07-12 07:47:59'),
(152, 'Muhammad ahnafusolikhin', 'Iin suwarti', 'SMP 2', 'JL.Pendowo RT.004/016 , Kelurahan Pendowo ,Kecamatan Kranggan ,Kabupaten Temanggung , Jawa Tengah 56271', 'foto-absensi/OLPxu4q1pzt5T3jKoqqZIZprFzO52dXPzOnGHKQP.jpg', '2022-07-12 07:48:54', '2022-07-12 07:48:54'),
(153, 'Firman kamilo', 'Khamdi', 'SMP 1', 'Asrama Brimob srondol', 'foto-absensi/Nugp0Kdun2NKMFwbMgDSLLraq3jTArGsG3ZZoaPj.jpg', '2022-07-12 07:49:03', '2022-07-12 07:49:03'),
(154, 'Alika zelda chairunnisa', 'Alex rudiyanto', 'MTS', 'Jl. Kenanga baru 2 RT11 RW02 Rejosari, Genuk Ungaran Barat', 'foto-absensi/nAY6KRTV8dGVpdrU1YEMW7qHLmIVOpKPcCzUVCEw.webp', '2022-07-12 07:49:22', '2022-07-12 07:49:22'),
(155, 'Mar-ah Nila Maghfiroh', 'Ani Siswanti', 'MTS', 'Dusun Gunung Jayan Rt 4 Rw 12 Desa bancak Kec. Bancak Kab. Semarang', 'foto-absensi/r4itZoRadyNR0Jai8403lTTHpxG3kPocF91qMa04.jpg', '2022-07-12 07:50:55', '2022-07-12 07:50:55'),
(156, 'Aulia Fatimah Azahra', 'Ambar Kurniasih', 'SMP 1', 'Duwet Bringin RT 002 RW 004 Ngaliyan Semarang', 'foto-absensi/SthZ1SVIra6hboE8V5KjC74ma9QSEc9MJKHhcG8B.jpg', '2022-07-12 07:51:33', '2022-07-12 07:51:33'),
(157, 'Alfino garda pamungkas', 'Sunarno', 'SMP 1', 'Jalan Panjaitan no13 Ungaran timur', 'foto-absensi/rknavYcaPdlJaDLd71tzpBYokIuOEtHhMPQ5yMEE.jpg', '2022-07-12 07:52:05', '2022-07-12 07:52:05'),
(158, 'Muhammad Salman Kurniawan', 'Isniyatun', 'SMP 1', 'Kendal boja klesem RT 1 RW 9', 'foto-absensi/GolBMCphMtnSPlqkRHEUM9mJfIcjHI4N2tKaMaSA.jpg', '2022-07-12 07:52:44', '2022-07-12 07:52:44'),
(159, 'FAIQA SYAHDA ZUHAIRA', 'CAHYO SUAMRI', 'SMP 1', 'Pundung Putih RT3/RW III,Gedang anak, Ungaran Timur', 'foto-absensi/VlDDWv13KfU3kv6HCXrjseF9uxDHoZxCE8hUQu8H.jpg', '2022-07-12 07:52:47', '2022-07-12 07:52:47'),
(160, 'Difla ilfi Chasanah', 'Madiyono', 'SMK', 'Dusun candi ,desa Umbulsari ,kecamatan windusari, kabupaten Magelang , provinsi Jawa tengah', 'foto-absensi/kZcU2gCTZXe8bTzzxQK6rTZnP4RbrsgHilrhD76i.jpg', '2022-07-12 07:53:08', '2022-07-12 07:53:08'),
(161, 'Naura Rameyza Alya', 'Saroji', 'SMP 1', 'Krajan klepu rt01/rw01 kel. Pringapus kab. Semarang', 'foto-absensi/7WTRdbsoyN0qokIgWJrmBYgoSbbosUXiTRq0hJe8.jpg', '2022-07-12 07:53:17', '2022-07-12 07:53:17'),
(162, 'Nayla Aninda Salwa', 'Ibnu Mundir', 'MA', 'Dsn.Ngrapah , RT 01/02 , Ds.Ngrapah , Kec.Banyubiru , Kab.Semarang', 'foto-absensi/t4tUSmkybpynn8Zu2ojROq4P1VwxuonWL5ezSSk0.webp', '2022-07-12 07:53:20', '2022-07-12 07:53:20'),
(163, 'Ulfa Najia', 'Mun\'im', 'MA', 'Sungai Rumbai, Dharmasraya, Sumatra Barat', 'foto-absensi/2cYbJwyV6Y9zbwDAYjqyfjwz3302G2t6hWbci4kJ.jpg', '2022-07-12 07:54:08', '2022-07-12 07:54:08'),
(164, 'Athiyya noya naafi lestari', 'Margono', 'SMP 1', 'Lingkungan Krajan lor RT 01 RW 04 wujil', 'foto-absensi/nKVmtZRLc5ecrLWKTYfcA4CgYlqOxpi7dlQVDlMS.jpg', '2022-07-12 07:54:18', '2022-07-12 07:54:18'),
(165, 'Jihan Nabiha Budiono', 'Agus Budiono/ferry desyawaty', 'MTS', 'Jl.Cempedak Selatan RT 02 RW 01 no 35', 'foto-absensi/rI1hPDCgooU0Xcue5uk3BYxXuQAgit7jXmAaJvzu.jpg', '2022-07-12 07:56:19', '2022-07-12 07:56:19'),
(166, 'Adelia sarafina ekameka', 'Lilik haryono', 'SMP 1', 'Jl.bintoro kecil2 rt02/rw08 pandean lamper,gayamsari', 'foto-absensi/P1Byn3yBoARHSZ8Wwjfbo98DVEJ9N1Nf67eHCQ7p.jpg', '2022-07-12 07:56:30', '2022-07-12 07:56:30'),
(167, 'Meyla Atha Atikah', 'Sujatiko', 'SMP 1', 'Bender dukuh RT 01 RW 07\r\nKalisidi Ungaran barat', 'foto-absensi/NyAtSEsMYgvm3sSEAbjZ0dxDaLS8t0sxVYmfa0US.jpg', '2022-07-12 07:56:33', '2022-07-12 07:56:33'),
(168, 'Putra aji pamungkas', 'Rochmad/musriah', 'SMP 2', 'Kebonharjo 2/4 patebon kendal', 'foto-absensi/iNWL0eHfn4uG8SRF5dF8gOB5YWpMrZzPCx3t4axk.jpg', '2022-07-12 07:57:06', '2022-07-12 07:57:06'),
(169, 'Ismi Arifatun', 'Mawaddah', 'MA', 'Ds Wadas RT 3/RW 1 kec.plantungan KB.kendal', 'foto-absensi/eg7O9yRTxkLLSi69bR1O5qYRaUQ70VPRBUDMgRlZ.jpg', '2022-07-12 07:57:23', '2022-07-12 07:57:23'),
(170, 'Reikhanna putri Sabrina Al kharir', 'Sri rahayuningsih', 'SMP 1', 'Dusun deso , desa Jetis , kec Bandungan, kab Semarang', 'foto-absensi/FpOltvOcY02DIrSuD3CWQCi662PNJwOqycsQRtWz.webp', '2022-07-12 07:57:50', '2022-07-12 07:57:50'),
(171, 'AULIA JUNITA RAHAYU', 'BUDI WAHYONO', 'SMP 1', 'PUCUNG RT 03 RW 01. KEL. BAMBAN KEREP. KEC. NGALIYAN', 'foto-absensi/DKdEl2Ao2GcMLCtm6ipZVjjAicOaLxYnHoWNWRUE.jpg', '2022-07-12 07:58:57', '2022-07-12 07:58:57'),
(172, 'ARLETTA ANINDITA PUTRI KALIZA', 'SULISTIANINGSIH', 'SMP 1', 'MASIRAN KALIGADING RT 02/ RW02', 'foto-absensi/R6bwPUEoiYUMkDdU1s3Xv7GIZDUuelsro6UEyiPD.jpg', '2022-07-12 07:59:20', '2022-07-12 07:59:20'),
(173, 'Lenna aprilya sukarno putri', 'Sukarno', 'SMP 1', 'Rt 6 Rw 1 Desa wringin putih,kec. Bergas,Kab.Semarang', 'foto-absensi/hvzcaMa35v6UdKi5SjBR6UWSuOR8kJGOwDZ3F0Zt.jpg', '2022-07-12 08:00:02', '2022-07-12 08:00:02'),
(174, 'Ifaninaura Sukma Ayu Anggi Pratiwi', 'Bardo Sutrisno', 'SMP 2', 'Klesem Kidul rt2 rw2', 'foto-absensi/6g0lUAjzw9ClE3ASJhZlEpCoQX2zqneLhY18oLZ9.jpg', '2022-07-12 08:00:32', '2022-07-12 08:00:32'),
(175, 'Muhammad Afnan', 'Ahmad Teguh Arifianto', 'MTS', 'Prampelan-Beji Rt 02/Rw 06 Ungaran Timur', 'foto-absensi/TgSL7QSwoBtrWfZfBI5XFMnZCNq3cG0PqcsvtY2Z.jpg', '2022-07-12 08:00:41', '2022-07-12 08:00:41'),
(176, 'Fatikha Kurnia Zoughbi', 'Mochammad Surono', 'SMK', 'Kertomulyo Rt4 Rw7 Desa Kertomulyo Kec. Brangsong Kab. Kendal Prov. Jawa Tengah', 'foto-absensi/DxsbFR5IujHFeInU53jBNa6IH8LFFqirBC0YRU50.jpg', '2022-07-12 08:03:08', '2022-07-12 08:03:08'),
(177, 'Suci Khoirunnisa', 'Bp.Sodikin', 'MA', 'Dsn.Geblok 1/6,Purwogondo,Boja,Kendal', 'foto-absensi/IgmUm7QDlMjklEsPYZT9PetnhH9QozCYOElPUmy0.jpg', '2022-07-12 08:03:15', '2022-07-12 08:03:15'),
(178, 'Muhammad haikal Khabibie', 'Sholichin se', 'MA', 'Des sumberejo kec kaliwungu kab kendal', 'foto-absensi/YGIQh9nI8WstgbziljClOq48ljqcb9ktJngI9DHv.jpg', '2022-07-12 08:05:56', '2022-07-12 08:05:56'),
(179, 'Gian Rafif Rayhan Wahyudi', 'Iwan Wahyudi', 'SMP 1', 'Perum Bukit Mandiri Beringin Blok C1\r\nNgalian Semarang', 'foto-absensi/CfJFl7rziX4xvmDtLJ4RlzMdbo5CXLJSdXRXbeZU.jpg', '2022-07-12 08:07:47', '2022-07-12 08:07:47'),
(180, 'Risma dwi astuti', 'Nur edi', 'MA', 'Grendem campurejo boja', 'foto-absensi/LFYo4PeAWG9MhMKSxea0KfKG59nuYKOiJqPClsh9.jpg', '2022-07-12 08:10:55', '2022-07-12 08:10:55'),
(181, 'Husna muflihah', 'Bp Yazid', 'MA', 'Dk sambung rt 01rw 01 rowosari tembalang semarang', 'foto-absensi/w2Jxxm21LZ4QPFFmxasXPxU0QfTJ7jasBE1Fd6K5.jpg', '2022-07-12 08:12:25', '2022-07-12 08:12:25'),
(182, 'M.fidi Rifki amrilah', 'Solichul hadi', 'SMP 1', 'Kebonharjo RT 3 RW 6', 'foto-absensi/rc5Ym46iQM9VLBxiQRRda8dGKrB9p4CjQwqOhGAf.jpg', '2022-07-12 08:13:50', '2022-07-12 08:13:50'),
(183, 'Muhamad Daffa Fauzan', 'Mahroni', 'SMP 2', 'Jln.pete selatan 1 rt 02 rw 01 ,Sekaran , Gunungpati', 'foto-absensi/jLrfqRpDGCwH4pBU5BSoQzySPAmQediRCX0NaydW.jpg', '2022-07-12 08:18:21', '2022-07-12 08:18:21'),
(184, 'Ahmad Kurniawan', 'Nur afwan', 'SMK', 'Brayo barat kertosari kec singorojo kab  kendal', 'foto-absensi/a4vPKfo7T4qwioKH1bXyVxm6b3an3jC6rkffCMGw.jpg', '2022-07-12 08:19:35', '2022-07-12 08:19:35'),
(185, 'Nasucha Eri Setiawan', 'Nur Setiawan', 'SMP 1', 'Kampung lembayung RT 01 Rw04 Sendangguwo Tembalang Semarang', 'foto-absensi/58faeuaRZF7l5CUzoUD2V9QcaGSEX2lSvRJ5sd3f.jpg', '2022-07-12 08:19:53', '2022-07-12 08:19:53'),
(186, 'Refano Maulana Pratama', 'Margono', 'SMP 1', 'Jl. Jangli tlawah II Kel.Jatingaleh Semarang', 'foto-absensi/XJeDO6k5awzQcwsJQxe5x1fXM2Q40zy7khH2EnfC.jpg', '2022-07-12 08:20:36', '2022-07-12 08:20:36'),
(187, 'Elicia cherish nafisah', 'Erma hafifah', 'SMP 1', 'Pringapus RT 03 RW 01', 'foto-absensi/Kv0bLLSzFlX2DRCB4nBc0SnHxWiXFk0A2V7PZpMl.jpg', '2022-07-12 08:26:18', '2022-07-12 08:26:18'),
(188, 'Muhammad irzza agustian wijaya', 'Sri maryono', 'SMP 1', 'Cabean rt10/03,sembungan,nogosari,boyolali', 'foto-absensi/rPyDAgHSgaUEtF1GXVhvSuNYNwOYl6VWjn02SMbE.jpg', '2022-07-12 08:29:38', '2022-07-12 08:29:38'),
(189, 'Almira maylani munif', 'Katik Jayanti', 'SMP 1', 'Kalikangkung RT 3 RW 1 gondoriyo Ngaliyan Semarang', 'foto-absensi/2p0zSSCMHL3JGtxbc4a4ubxXwLWJ3Cz4lSOTbT6B.jpg', '2022-07-12 08:30:19', '2022-07-12 08:30:19'),
(190, 'Keisya Aidi', 'Novita Koes', 'SMP 1', 'Pudak payung, Banyumanik, Semarang, \r\nMaaf foto memori gak bs, jd ambil asal', 'foto-absensi/aYlwL3uO2lqEJIXdTFHfl58xY8gX4x4bOXQuBKdQ.jpg', '2022-07-12 08:34:00', '2022-07-12 08:34:00'),
(191, 'Keisya Aidi mellinda', 'Novita Koes mellinda anggraeni', 'SMP 1', 'Pudak payung setuk 01/04 Banyumanik semarang', 'foto-absensi/WemoVPuNu47jPVKsDAISUKINo1vHOm0DFhSV9All.jpg', '2022-07-12 08:40:59', '2022-07-12 08:40:59'),
(192, 'Rizkia Cantika Putri Prasetyanto', 'Galih Prasetyanto', 'SMP 1', 'Krajan Klepu RT 01 RW 01 kecamatan pringapus kabupaten Semarang', 'foto-absensi/SIsisTz0nDzItP5C1OhSAtE6xmjmRlmPwAC6BAcb.jpg', '2022-07-12 08:47:08', '2022-07-12 08:47:08'),
(193, 'Bagiz Zhalifunnas', 'Dewi Marlina', 'SMP 2', 'Solo', 'foto-absensi/yrGnuWsNtYRhiRjkpjGDcv5ZNbu2s2JLOo4jxKlQ.jpg', '2022-07-12 08:48:01', '2022-07-12 08:48:01'),
(194, 'Keisya Aidi Melinda', 'Novita Koes Mellinda Anggraeni', 'SMP 1', 'Pudak Payung, Banyumanik, Semarang', 'foto-absensi/jLeZEj0bLwsbumjlvGSDJR2fsEF2ebkAubDlQjSW.jpg', '2022-07-12 08:56:44', '2022-07-12 08:56:44'),
(195, 'Fattahillah Alamsyah', 'Heri Wibowo', 'SMP 1', 'Graha Pesona Jatisari blok B8 no 15 Kel Jatisari Kec Mijen', 'foto-absensi/mc2rzOyTQe9Qi4ei1aftofs83SB4WjTpKJnqmNIj.jpg', '2022-07-12 09:03:35', '2022-07-12 09:03:35'),
(196, 'Vano Rifqi Kurnia F', 'Indarti', 'SMP 1', 'Ngasem lor DS Jetis kec Bandungan', 'foto-absensi/nfs4jpBB00Klk52tXP4DFqP5fxy1re3tcQuW6CaK.jpg', '2022-07-12 09:03:52', '2022-07-12 09:03:52'),
(197, 'Javas Nararya El Syukri', 'Astri Widiati', 'SMP 1', 'Bekasi Griya Asri 2 Blok CA3/11\r\nTembun Selatan, Bekasi', 'foto-absensi/KVP62n1XeZv82BcJ9FABrBO0mIJdXKTynDLmm6Mm.jpg', '2022-07-12 09:09:01', '2022-07-12 09:09:01'),
(198, 'Sabrina maharani', 'Mas \'udah', 'SMP 2', 'Jl gayamsari 4 no 1 rt 02 rw 12 gemah pedurungan semarang', 'foto-absensi/rapOE8KXFbZJtZk3vFl3HlwZOLakMxnhqBF2Sq5e.jpg', '2022-07-12 09:13:48', '2022-07-12 09:13:48'),
(199, 'CHIKA AULIA WIJAYANTI', 'EKO WIJAYANTO', 'SMP 2', 'Mijen RT 02/ RW 01', 'foto-absensi/BgKcfB7VINU0XspDEdUjQ1XNYzEV5gth9MqIja6G.jpg', '2022-07-12 09:30:41', '2022-07-12 09:30:41'),
(200, 'Habibi Fadhil Sauqi Nugroho', 'Nina Tanti Nerawati', 'SMP 1', 'Jl Dr Cipto Petelan Utara 907 Semarang Timur-', 'foto-absensi/adh5Mff42qKSF8iNhokimFKjl60108nJ0ym6jLUd.jpg', '2022-07-12 09:57:58', '2022-07-12 09:57:58'),
(201, 'Nanang Kamal batssa', 'Agus susiono dan nur riyanti', 'SMK', 'Tegalsari,kec prigapus,kab semarang', 'foto-absensi/tu5ODmJk1BsCsUTVxz2091P1r7NSpEJ5AEayCFKO.jpg', '2022-07-12 10:52:40', '2022-07-12 10:52:40'),
(202, 'Amin mubarok', 'Bp zamroni', 'MA', 'Ngaliyan wates', 'foto-absensi/brIJkPv9Oym8VhVHoDOKnnxkeTcrH4hOl3UyQvEj.jpg', '2022-07-12 15:24:16', '2022-07-12 15:24:16'),
(203, 'Muhammad daffa raditya pratama', 'Masrohan', 'SMP 1', 'Jl. Flamboyan raya rt01rw04.kalirejo,ungaran timur, kab semarang', 'foto-absensi/60NUgOgy3H20A5H5KvzKuRn4639NUdTkesGOvCWR.jpg', '2022-07-12 15:29:11', '2022-07-12 15:29:11'),
(204, 'Rahmad Erda pratama', 'Erna Hidayati', 'SMK', 'Kuncen,kel.bubakan,kec.mijen,kota Semarang', 'foto-absensi/n0nD2qpJtk71igpdocFGzD4emNZ6ahxPNzM57Epk.jpg', '2022-07-12 15:38:09', '2022-07-12 15:38:09'),
(205, 'Amelia Rossalita', 'Edi Jatmiko', 'SMP 1', 'Dusun Kepil Rt 01/04, Desa. Kebumen, Kec. Banyubiru, Kab. Semarang, Prov. Jateng', 'foto-absensi/SXsbsFikkNLLm5EDCYwxFD6aR4DE4clcp7xIyGTZ.jpg', '2022-07-12 17:08:50', '2022-07-12 17:08:50'),
(206, 'Fattakh Ardian', 'Priyanto', 'SMP 1', 'Perumahan Graha Mulya Asri 4 Blok A 18 Rt 09 Rw 3 Desa Sumberejo Kecamatan Kaliwungu Kabupaten Kendal', 'foto-absensi/uWQGnKhG05zzBQMzsWNb0haoaRkesu5XJBee6ZPD.jpg', '2022-07-12 17:37:10', '2022-07-12 17:37:10'),
(207, 'Muhamad irfan aulinaja', 'Munadhiroh', 'SMK', 'Banyuringi , singorojo kendal', 'foto-absensi/W9sA5c50nETjexy3eY7gKsxA50YNptkGq4tTXAC2.jpg', '2022-07-12 19:34:57', '2022-07-12 19:34:57'),
(208, 'Fariza khairunnisa', 'Fajar utomo', 'SMP 1', 'Ngempon rt 01/05 kek ngempon kec bergas kab semarang', 'foto-absensi/5xU0fvPG4lcg9g4JKMYr0aPCWHgwayArrrvlAd43.jpg', '2022-07-12 19:56:44', '2022-07-12 19:56:44'),
(209, 'prabu anggara', 'Defy permatasari', 'SMP 2', 'DS. Wangandawa RT.11/RW.03\r\nKec.Talang , Kab.Tegal', 'foto-absensi/tTQoZmWqVTblyMRpajtAEwhDY4f4U6394T5NqHd0.jpg', '2022-07-12 20:12:27', '2022-07-12 20:12:27'),
(210, 'Desma ckhumairah cahyawati', 'Amat Basari', 'SMP 1', 'Jl Kalipepe 3 RT 04/RW 01 pudak payung Semarang', 'foto-absensi/kecvaBuNQnNR9AhBOF936H7lNlRYLjrZD8BvFe7j.jpg', '2022-07-12 21:07:51', '2022-07-12 21:07:51'),
(211, 'Nama arif bhekti prasetyo', 'nur arifin', 'SMP 1', 'muteran rt4 rw3 pudak payung banyu manik', 'foto-absensi/qv6YmvSediWKTEhojTJw4bKFqftktUAXHXEKWmBb.jpg', '2022-07-12 21:24:37', '2022-07-12 21:24:37'),
(212, 'Cinta Nuril Ramadhania', 'Rokhasih Tianti', 'SMP 1', 'Jl. Sendang Utara 3 Rt 1 Rw 7 Gemah, Pedurungan, Semarang', 'foto-absensi/kvVKm5lOnILjvNpLQ1BYX27omFkko4n6OeDSxm1H.jpg', '2022-07-12 21:55:08', '2022-07-12 21:55:08'),
(213, 'Wina Isrofi Ayu Pramudita', 'Ibu Margiyati', 'SMP 1', 'Gintungan Rt7/2, UngBar', 'foto-absensi/koXVugUu0sC6VdDDuxg8YeV8J7dTkUAuBpEEv89z.jpg', '2022-07-13 01:01:32', '2022-07-13 01:01:32'),
(214, 'Yasmin nurul huda', 'Ayik indriani', 'SMP 1', 'Dsn silowah rt2 rw6 pagersari bergas', 'foto-absensi/rXAJw2x9RqEdiCO7K2955jGwJU1DPOYz5edZG38w.jpg', '2022-07-13 01:08:29', '2022-07-13 01:08:29'),
(215, 'Yasmin nurul H', 'Ayik Indriyani', 'SMP 1', 'Dsn silowah rt2 rw6 pagersari bergas', 'foto-absensi/fbhwVlmtvarGLBRxpVzV0uwAw6JFGubpMCQWNQEC.jpg', '2022-07-13 01:11:11', '2022-07-13 01:11:11'),
(216, 'Revan Cahaya Revan', 'Ajat Sudrajat', 'SMP 1', 'Langensari,ungaran barat,rt 10,rw 5 ,kabupaten semarang', 'foto-absensi/JnfuiV4op2ppIBy5lJwBdgnCTB5mTZQpVeI1tzIC.jpg', '2022-07-13 05:18:13', '2022-07-13 05:18:13'),
(217, 'Aprilian Hendi pratama', 'Hendi sukono', 'SMP 1', 'Langensari Ungaran barat RT10 RW05 kab Semarang', 'foto-absensi/nd8dPUz4Sl22DA7XApEYrkD1fkfnm3uDJNslgn9q.jpg', '2022-07-13 05:20:58', '2022-07-13 05:20:58');

-- --------------------------------------------------------

--
-- Struktur dari tabel `biaya`
--

CREATE TABLE `biaya` (
  `id` bigint(20) UNSIGNED NOT NULL,
  `smpreg1` varchar(255) COLLATE utf8mb4_unicode_ci NOT NULL,
  `smpnonreg1` varchar(255) COLLATE utf8mb4_unicode_ci NOT NULL,
  `smpreg2` varchar(255) COLLATE utf8mb4_unicode_ci NOT NULL,
  `smpnonreg2` varchar(255) COLLATE utf8mb4_unicode_ci NOT NULL,
  `mtsreg1` varchar(255) COLLATE utf8mb4_unicode_ci NOT NULL,
  `mtsnonreg1` varchar(255) COLLATE utf8mb4_unicode_ci NOT NULL,
  `mtsreg2` varchar(255) COLLATE utf8mb4_unicode_ci NOT NULL,
  `mtsnonreg2` varchar(255) COLLATE utf8mb4_unicode_ci NOT NULL,
  `smkreg1` varchar(255) COLLATE utf8mb4_unicode_ci NOT NULL,
  `smknonreg1` varchar(255) COLLATE utf8mb4_unicode_ci NOT NULL,
  `smkreg2` varchar(255) COLLATE utf8mb4_unicode_ci NOT NULL,
  `smknonreg2` varchar(255) COLLATE utf8mb4_unicode_ci NOT NULL,
  `mareg1` varchar(255) COLLATE utf8mb4_unicode_ci NOT NULL,
  `manonreg1` varchar(255) COLLATE utf8mb4_unicode_ci NOT NULL,
  `mareg2` varchar(255) COLLATE utf8mb4_unicode_ci NOT NULL,
  `manonreg2` varchar(255) COLLATE utf8mb4_unicode_ci NOT NULL,
  `created_at` timestamp NULL DEFAULT NULL,
  `updated_at` timestamp NULL DEFAULT NULL
) ENGINE=InnoDB DEFAULT CHARSET=utf8mb4 COLLATE=utf8mb4_unicode_ci;

--
-- Dumping data untuk tabel `biaya`
--

INSERT INTO `biaya` (`id`, `smpreg1`, `smpnonreg1`, `smpreg2`, `smpnonreg2`, `mtsreg1`, `mtsnonreg1`, `mtsreg2`, `mtsnonreg2`, `smkreg1`, `smknonreg1`, `smkreg2`, `smknonreg2`, `mareg1`, `manonreg1`, `mareg2`, `manonreg2`, `created_at`, `updated_at`) VALUES
(1, '3.600.000', '6.050.000', '4.600.000', '7.050.000', '3.600.000', '6.050.000', '4.600.000', '7.050.000', '3.900.000', '6.350.000', '4.900.000', '7.350.000', '3.650.000', '6.100.000', '4.650.000', '7.100.000', NULL, '2021-12-21 09:25:43');

-- --------------------------------------------------------

--
-- Struktur dari tabel `biaya_awal_masuk`
--

CREATE TABLE `biaya_awal_masuk` (
  `id` bigint(20) UNSIGNED NOT NULL,
  `siswa_id` bigint(20) UNSIGNED DEFAULT NULL,
  `jalurpendaftaran` varchar(255) COLLATE utf8mb4_unicode_ci DEFAULT NULL,
  `jenjang` varchar(255) COLLATE utf8mb4_unicode_ci DEFAULT NULL,
  `prodi` varchar(191) COLLATE utf8mb4_unicode_ci DEFAULT NULL,
  `nama` varchar(255) COLLATE utf8mb4_unicode_ci DEFAULT NULL,
  `fasilitas` varchar(255) COLLATE utf8mb4_unicode_ci DEFAULT NULL,
  `jeniskelamin` varchar(255) COLLATE utf8mb4_unicode_ci DEFAULT NULL,
  `waktu` varchar(191) COLLATE utf8mb4_unicode_ci DEFAULT NULL,
  `biaya` int(191) DEFAULT NULL,
  `registrasi` varchar(255) COLLATE utf8mb4_unicode_ci DEFAULT NULL,
  `lunas` varchar(255) COLLATE utf8mb4_unicode_ci DEFAULT NULL,
  `upload` varchar(500) COLLATE utf8mb4_unicode_ci DEFAULT NULL,
  `created_at` timestamp NULL DEFAULT NULL,
  `updated_at` timestamp NULL DEFAULT NULL
) ENGINE=InnoDB DEFAULT CHARSET=utf8mb4 COLLATE=utf8mb4_unicode_ci;

--
-- Dumping data untuk tabel `biaya_awal_masuk`
--

INSERT INTO `biaya_awal_masuk` (`id`, `siswa_id`, `jalurpendaftaran`, `jenjang`, `prodi`, `nama`, `fasilitas`, `jeniskelamin`, `waktu`, `biaya`, `registrasi`, `lunas`, `upload`, `created_at`, `updated_at`) VALUES
(76, 132, NULL, NULL, NULL, 'Fatikha kurnia zoughbi', NULL, NULL, '01-01-2022', NULL, 'belum', 'belum', NULL, '2021-12-31 20:08:46', '2021-12-31 20:08:46'),
(77, 133, NULL, NULL, NULL, 'Arum Maysah Aristawati', NULL, NULL, '01-01-2022', NULL, 'belum', 'belum', NULL, '2021-12-31 20:58:39', '2021-12-31 20:58:39'),
(78, 134, NULL, NULL, NULL, 'Siti Khoirunnisa Hasna', NULL, NULL, '01-01-2022', NULL, 'belum', 'belum', NULL, '2021-12-31 21:36:56', '2021-12-31 21:36:56'),
(79, 135, NULL, NULL, NULL, 'LU`LUIL MAKNUN HUSNA', NULL, NULL, '01-01-2022', NULL, 'belum', 'belum', NULL, '2021-12-31 21:50:22', '2021-12-31 21:50:22'),
(80, 136, NULL, NULL, NULL, 'ALMIRA SANDRA DEWI', NULL, NULL, '01-01-2022', NULL, 'belum', 'belum', NULL, '2021-12-31 22:09:41', '2021-12-31 22:09:41'),
(81, 137, NULL, NULL, NULL, 'DANISWARA NAUFAL ARIQ', NULL, NULL, '01-01-2022', NULL, 'belum', 'belum', NULL, '2021-12-31 22:30:52', '2021-12-31 22:30:52'),
(82, 136, 'Offline', 'SMP 1', NULL, 'ALMIRA SANDRA DEWI', 'Non Reguler', 'Perempuan', '01-01-2022', 3000000, 'sudah registrasi', 'belum lunas', NULL, '2021-12-31 22:41:32', '2021-12-31 22:41:32'),
(83, 138, NULL, NULL, NULL, 'MUHAMMAD KURNIAWAN SAPUTRA', NULL, NULL, '01-01-2022', NULL, 'belum', 'belum', NULL, '2021-12-31 23:04:06', '2021-12-31 23:04:06'),
(84, 140, NULL, NULL, NULL, 'Naura  Zalfa Khansa', NULL, NULL, '02-01-2022', NULL, 'belum', 'belum', NULL, '2022-01-01 19:42:38', '2022-01-01 19:42:38'),
(85, 141, NULL, NULL, NULL, 'Nasucha Eri Setiawwan', NULL, NULL, '02-01-2022', NULL, 'belum', 'belum', NULL, '2022-01-01 20:07:43', '2022-01-01 20:07:43'),
(86, 142, NULL, NULL, NULL, 'Nila Amalia  Nabila', NULL, NULL, '02-01-2022', NULL, 'belum', 'belum', NULL, '2022-01-01 21:15:10', '2022-01-01 21:15:10'),
(87, 143, NULL, NULL, NULL, 'Widya Nafilatuz Zahwa', NULL, NULL, '02-01-2022', NULL, 'belum', 'belum', NULL, NULL, NULL),
(88, 139, NULL, NULL, NULL, 'SANSA ADHWAA MAULIDA', NULL, NULL, '02-01-2022', NULL, 'belum', 'belum', NULL, NULL, NULL),
(89, 144, NULL, NULL, NULL, 'Nayla Aninda Salwa', NULL, NULL, '02-01-2022', NULL, 'belum', 'belum', NULL, '2022-01-02 02:00:17', '2022-01-02 02:00:17'),
(90, 145, NULL, NULL, NULL, 'Azkiya rifdatul adzra', NULL, NULL, '02-01-2022', NULL, 'belum', 'belum', NULL, '2022-01-02 04:32:11', '2022-01-02 04:32:11'),
(92, 148, NULL, NULL, NULL, 'Audreya Nadila rizki', NULL, NULL, '02-01-2022', NULL, 'belum', 'belum', NULL, '2022-01-02 15:20:53', '2022-01-02 15:20:53'),
(97, 150, NULL, NULL, NULL, 'Achsan Nur Rosyid', NULL, NULL, '03-01-2022', NULL, 'belum', 'belum', NULL, '2022-01-02 19:25:06', '2022-01-02 19:25:06'),
(98, 151, NULL, NULL, NULL, 'Anindya Putri Rahmawati', NULL, NULL, '03-01-2022', NULL, 'belum', 'belum', NULL, '2022-01-02 19:37:11', '2022-01-02 19:37:11'),
(99, 152, NULL, NULL, NULL, 'Elly Rohmawati', NULL, NULL, '03-01-2022', NULL, 'belum', 'belum', NULL, '2022-01-02 20:23:39', '2022-01-02 20:23:39'),
(100, 153, NULL, NULL, NULL, 'Carisa Salsabila Firdausa', NULL, NULL, '03-01-2022', NULL, 'belum', 'belum', NULL, '2022-01-02 20:26:57', '2022-01-02 20:26:57'),
(101, 154, NULL, NULL, NULL, 'Aisyah Eka Putri Ardhiyanto', NULL, NULL, '03-01-2022', NULL, 'belum', 'belum', NULL, '2022-01-02 21:40:04', '2022-01-02 21:40:04'),
(102, 155, NULL, NULL, NULL, 'Latifatul Maela', NULL, NULL, '03-01-2022', NULL, 'belum', 'belum', NULL, '2022-01-02 22:00:11', '2022-01-02 22:00:11'),
(103, 156, NULL, NULL, NULL, 'Ardi Brilliant Martaretta Pradani', NULL, NULL, '03-01-2022', NULL, 'belum', 'belum', NULL, '2022-01-02 22:16:31', '2022-01-02 22:16:31'),
(104, 157, NULL, NULL, NULL, 'Adrean Akhmal Siswanto', NULL, NULL, '03-01-2022', NULL, 'belum', 'belum', NULL, '2022-01-02 22:32:17', '2022-01-02 22:32:17'),
(105, 158, NULL, NULL, NULL, 'Tazkiyatul Munna', NULL, NULL, '03-01-2022', NULL, 'belum', 'belum', NULL, '2022-01-02 22:59:01', '2022-01-02 22:59:01'),
(106, 159, NULL, NULL, NULL, 'Elly Rohmawati', NULL, NULL, '03-01-2022', NULL, 'belum', 'belum', NULL, '2022-01-02 23:13:43', '2022-01-02 23:13:43'),
(107, 160, NULL, NULL, NULL, 'Achmad Haikal Aunan Nasich', NULL, NULL, '03-01-2022', NULL, 'belum', 'belum', NULL, '2022-01-02 23:44:58', '2022-01-02 23:44:58'),
(108, 161, NULL, NULL, NULL, 'Carissa Salsabila Firdausa', NULL, NULL, '03-01-2022', NULL, 'belum', 'belum', NULL, '2022-01-02 23:56:52', '2022-01-02 23:56:52'),
(109, 162, NULL, NULL, NULL, 'Elly Rohmawati', NULL, NULL, '03-01-2022', NULL, 'belum', 'belum', NULL, '2022-01-03 00:03:39', '2022-01-03 00:03:39'),
(110, 163, NULL, NULL, NULL, 'Muchammad Miftaachul Falaach', NULL, NULL, '03-01-2022', NULL, 'belum', 'belum', NULL, '2022-01-03 00:27:55', '2022-01-03 00:27:55'),
(111, 164, NULL, NULL, NULL, 'Masna Nur Aisah', NULL, NULL, '03-01-2022', NULL, 'belum', 'belum', NULL, '2022-01-03 04:04:26', '2022-01-03 04:04:26'),
(112, 165, NULL, NULL, NULL, 'ZAKIYA AMALIA SOFA', NULL, NULL, '03-01-2022', NULL, 'belum', 'belum', NULL, '2022-01-03 06:42:07', '2022-01-03 06:42:07'),
(115, 168, NULL, NULL, NULL, 'Audreya Nadila Rizqi', NULL, NULL, '04-01-2022', NULL, 'belum', 'belum', NULL, '2022-01-03 18:12:15', '2022-01-03 18:12:15'),
(116, 169, NULL, NULL, NULL, 'Muhammad Daffa Fauzan', NULL, NULL, '04-01-2022', NULL, 'belum', 'belum', NULL, '2022-01-03 19:19:30', '2022-01-03 19:19:30'),
(117, 170, NULL, NULL, NULL, 'Muhammad Daffa Fauzan', NULL, NULL, '04-01-2022', NULL, 'belum', 'belum', NULL, '2022-01-03 19:28:37', '2022-01-03 19:28:37'),
(119, 171, 'Offline', 'MTs', NULL, 'NAHDYA NUR CHOIRINA', 'Reguler', 'Perempuan', '04-01-2022', 1500000, 'sudah registrasi', 'belum lunas', NULL, '2022-01-03 20:35:45', '2022-01-03 20:35:45'),
(123, 172, 'Offline', 'SMP 1', NULL, 'Aisya Nurul Adinda', 'Non Reguler', 'Perempuan', '04-01-2022', 3050000, 'angsuran', 'belum lunas', NULL, '2022-01-03 21:16:28', '2022-01-03 21:16:28'),
(124, 173, NULL, NULL, NULL, 'Fattahillah Alamsyah', NULL, NULL, '04-01-2022', NULL, 'belum', 'belum', NULL, '2022-01-03 21:24:56', '2022-01-03 21:24:56'),
(125, 173, 'Offline', 'SMP 1', NULL, 'Fattahillah Alamsyah', 'Reguler', 'Laki-laki', '04-01-2022', 600000, 'sudah registrasi', 'belum lunas', NULL, '2022-01-03 21:48:06', '2022-01-03 21:48:06'),
(126, 174, NULL, NULL, NULL, 'Alfiana Reza Rahmadhani', NULL, NULL, '04-01-2022', NULL, 'belum', 'belum', NULL, '2022-01-03 21:56:57', '2022-01-03 21:56:57'),
(128, 175, NULL, NULL, NULL, 'dwi julianto', NULL, NULL, '04-01-2022', NULL, 'belum', 'belum', NULL, '2022-01-04 00:07:12', '2022-01-04 00:07:12'),
(129, 176, NULL, NULL, NULL, 'Meyla Atha Athika', NULL, NULL, '04-01-2022', NULL, 'belum', 'belum', NULL, '2022-01-04 01:12:42', '2022-01-04 01:12:42'),
(130, 177, NULL, NULL, NULL, 'DESMA CKHUMAIROH CAHYAWATI', NULL, NULL, '04-01-2022', NULL, 'belum', 'belum', NULL, '2022-01-04 01:25:19', '2022-01-04 01:25:19'),
(131, 177, 'Offline', 'SMP 1', NULL, 'DESMA CKHUMAIROH CAHYAWATI', 'Non Reguler', 'Perempuan', '04-01-2022', 500000, 'sudah registrasi', 'belum lunas', NULL, '2022-01-04 01:34:43', '2022-01-04 01:34:43'),
(132, 176, 'Offline', 'SMP 1', NULL, 'Meyla Atha Athika', 'Non Reguler', 'Perempuan', '04-01-2022', 1500000, 'sudah registrasi', 'belum lunas', NULL, '2022-01-04 01:41:11', '2022-01-04 01:41:11'),
(133, 178, NULL, NULL, NULL, 'Maulida Rizki Sal Sabila', NULL, NULL, '04-01-2022', NULL, 'belum', 'belum', NULL, '2022-01-04 01:57:35', '2022-01-04 01:57:35'),
(134, 179, NULL, NULL, NULL, 'BILQIS NABILA AZ ZAHRA', NULL, NULL, '04-01-2022', NULL, 'belum', 'belum', NULL, '2022-01-04 02:15:34', '2022-01-04 02:15:34'),
(135, 180, NULL, NULL, NULL, 'TAFAUL KAYYASAH', NULL, NULL, '05-01-2022', NULL, 'belum', 'belum', NULL, '2022-01-04 20:30:21', '2022-01-04 20:30:21'),
(136, 181, NULL, NULL, NULL, 'Rasyid Dluyufur Rahman Sulaksono', NULL, NULL, '05-01-2022', NULL, 'belum', 'belum', NULL, '2022-01-04 21:31:11', '2022-01-04 21:31:11'),
(137, 182, NULL, NULL, NULL, 'Musyafak Adilla Saputra', NULL, NULL, '05-01-2022', NULL, 'belum', 'belum', NULL, '2022-01-04 22:33:42', '2022-01-04 22:33:42'),
(138, 183, NULL, NULL, NULL, 'ALYSA VANESSIANSYAH SAPUTRI', NULL, NULL, '05-01-2022', NULL, 'belum', 'belum', NULL, '2022-01-04 22:37:34', '2022-01-04 22:37:34'),
(139, 184, NULL, NULL, NULL, 'Safina Syava Felisha', NULL, NULL, '05-01-2022', NULL, 'belum', 'belum', NULL, '2022-01-04 23:34:09', '2022-01-04 23:34:09'),
(140, 185, NULL, NULL, NULL, 'Iqbal Zulian Widagdo', NULL, NULL, '05-01-2022', NULL, 'belum', 'belum', NULL, '2022-01-05 00:45:13', '2022-01-05 00:45:13'),
(141, 186, NULL, NULL, NULL, 'Armilda trinira ramadhani', NULL, NULL, '05-01-2022', NULL, 'belum', 'belum', NULL, '2022-01-05 07:06:40', '2022-01-05 07:06:40'),
(142, 187, NULL, NULL, NULL, 'Muhammad daffa raditya pratama', NULL, NULL, '05-01-2022', NULL, 'belum', 'belum', NULL, '2022-01-05 15:28:16', '2022-01-05 15:28:16'),
(144, 189, NULL, NULL, NULL, 'FIDO BAYU PRATAMA', NULL, NULL, '06-01-2022', NULL, 'belum', 'belum', NULL, '2022-01-05 19:45:00', '2022-01-05 19:45:00'),
(145, 190, NULL, NULL, NULL, 'tafaul kayyasah', NULL, NULL, '06-01-2022', NULL, 'belum', 'belum', NULL, '2022-01-05 20:50:43', '2022-01-05 20:50:43'),
(146, 191, NULL, NULL, NULL, 'laras ayuningtyas', NULL, NULL, '06-01-2022', NULL, 'belum', 'belum', NULL, '2022-01-05 20:57:44', '2022-01-05 20:57:44'),
(147, 192, NULL, NULL, NULL, 'beryl audris aljibran', NULL, NULL, '06-01-2022', NULL, 'belum', 'belum', NULL, '2022-01-05 21:12:45', '2022-01-05 21:12:45'),
(148, 193, NULL, NULL, NULL, 'm zulfa hafidz fadlu mubarok', NULL, NULL, '06-01-2022', NULL, 'belum', 'belum', NULL, '2022-01-05 21:19:25', '2022-01-05 21:19:25'),
(149, 194, NULL, NULL, NULL, 'javas nararya el syukuri', NULL, NULL, '06-01-2022', NULL, 'belum', 'belum', NULL, '2022-01-05 21:29:02', '2022-01-05 21:29:02'),
(150, 195, NULL, NULL, NULL, 'dwi ramadhan ardi lestari', NULL, NULL, '06-01-2022', NULL, 'belum', 'belum', NULL, '2022-01-05 21:40:52', '2022-01-05 21:40:52'),
(151, 196, NULL, NULL, NULL, 'ardian yudho nugroho', NULL, NULL, '06-01-2022', NULL, 'belum', 'belum', NULL, '2022-01-05 22:41:50', '2022-01-05 22:41:50'),
(152, 154, 'Offline', 'MTs', NULL, 'Aisyah Eka Putri Ardhiyanto', 'Non Reguler', 'Perempuan', '06-01-2022', 4000000, 'sudah registrasi', 'belum lunas', NULL, '2022-01-06 06:01:33', '2022-01-06 06:01:33'),
(153, 197, NULL, NULL, NULL, 'Gian Rafif Rayhan Wahyudi', NULL, NULL, '07-01-2022', NULL, 'belum', 'belum', NULL, '2022-01-06 19:16:59', '2022-01-06 19:16:59'),
(154, 198, NULL, NULL, NULL, 'Gian Rafif Rayhan Wahyudi', NULL, NULL, '07-01-2022', NULL, 'belum', 'belum', NULL, '2022-01-06 19:40:27', '2022-01-06 19:40:27'),
(155, 199, NULL, NULL, NULL, 'Wildan Alkan Fauzan', NULL, NULL, '07-01-2022', NULL, 'belum', 'belum', NULL, '2022-01-07 01:16:42', '2022-01-07 01:16:42'),
(156, 200, NULL, NULL, NULL, 'Gebrain Decalka Andal', NULL, NULL, '07-01-2022', NULL, 'belum', 'belum', NULL, '2022-01-07 01:52:15', '2022-01-07 01:52:15'),
(157, 201, NULL, NULL, NULL, 'Hably Arkan el Hady', NULL, NULL, '07-01-2022', NULL, 'belum', 'belum', NULL, '2022-01-07 03:58:54', '2022-01-07 03:58:54'),
(158, 202, NULL, NULL, NULL, 'Satria Bintang Prasetyo', NULL, NULL, '08-01-2022', NULL, 'belum', 'belum', NULL, '2022-01-07 19:18:26', '2022-01-07 19:18:26'),
(159, 202, 'Offline', 'MTs', NULL, 'Satria Bintang Prasetyo', 'Non Reguler', 'Laki-laki', '08-01-2022', 6050000, 'sudah registrasi', 'sudah lunas', NULL, '2022-01-07 20:07:44', '2022-01-07 20:07:44'),
(160, 203, NULL, NULL, NULL, 'ana wakhidatul inayah', NULL, NULL, '08-01-2022', NULL, 'belum', 'belum', NULL, '2022-01-07 21:16:52', '2022-01-07 21:16:52'),
(161, 204, NULL, NULL, NULL, 'Azizah Cahyani', NULL, NULL, '08-01-2022', NULL, 'belum', 'belum', NULL, '2022-01-07 21:43:53', '2022-01-07 21:43:53'),
(162, 205, NULL, NULL, NULL, 'Nadhira Zahwa Riskia', NULL, NULL, '08-01-2022', NULL, 'belum', 'belum', NULL, '2022-01-07 22:04:19', '2022-01-07 22:04:19'),
(163, 206, NULL, NULL, NULL, 'Muhammad Rafli', NULL, NULL, '08-01-2022', NULL, 'belum', 'belum', NULL, '2022-01-07 22:15:57', '2022-01-07 22:15:57'),
(164, 207, NULL, NULL, NULL, 'Wahyu Aisya Majidah', NULL, NULL, '08-01-2022', NULL, 'belum', 'belum', NULL, '2022-01-07 22:30:16', '2022-01-07 22:30:16'),
(165, 208, NULL, NULL, NULL, 'ANISA AULIA ZULUA RAMADHANI', NULL, NULL, '08-01-2022', NULL, 'belum', 'belum', NULL, '2022-01-07 22:58:04', '2022-01-07 22:58:04'),
(166, 209, NULL, NULL, NULL, 'NAURA RAMEYZA ALYA', NULL, NULL, '08-01-2022', NULL, 'belum', 'belum', NULL, '2022-01-07 23:14:09', '2022-01-07 23:14:09'),
(167, 210, NULL, NULL, NULL, 'MOHAMAD ABDUL ROSYID', NULL, NULL, '08-01-2022', NULL, 'belum', 'belum', NULL, '2022-01-07 23:27:13', '2022-01-07 23:27:13'),
(168, 211, NULL, NULL, NULL, 'SYIFAA ANIS MUTIA AZIZAH', NULL, NULL, '08-01-2022', NULL, 'belum', 'belum', NULL, '2022-01-07 23:48:43', '2022-01-07 23:48:43'),
(169, 212, NULL, NULL, NULL, 'FIQA SYAHDA ZAHIRA', NULL, NULL, '08-01-2022', NULL, 'belum', 'belum', NULL, '2022-01-07 23:59:50', '2022-01-07 23:59:50'),
(170, 213, NULL, NULL, NULL, 'Muhamad arifin ilham', NULL, NULL, '08-01-2022', NULL, 'belum', 'belum', NULL, '2022-01-08 17:10:32', '2022-01-08 17:10:32'),
(171, 214, NULL, NULL, NULL, 'Arza Qiena Burhan Aifandi', NULL, NULL, '09-01-2022', NULL, 'belum', 'belum', NULL, '2022-01-08 18:58:09', '2022-01-08 18:58:09'),
(172, 215, NULL, NULL, NULL, 'Banbang setiawan', NULL, NULL, '09-01-2022', NULL, 'belum', 'belum', NULL, '2022-01-08 19:42:01', '2022-01-08 19:42:01'),
(173, 216, NULL, NULL, NULL, 'Rizkia Cantika Putri Prasetyanto', NULL, NULL, '09-01-2022', NULL, 'belum', 'belum', NULL, '2022-01-08 19:54:29', '2022-01-08 19:54:29'),
(174, 217, NULL, NULL, NULL, 'Muhammad Alfath', NULL, NULL, '09-01-2022', NULL, 'belum', 'belum', NULL, '2022-01-08 20:48:42', '2022-01-08 20:48:42'),
(175, 218, NULL, NULL, NULL, 'Endra Bagas Mahatma', NULL, NULL, '09-01-2022', NULL, 'belum', 'belum', NULL, '2022-01-08 20:54:40', '2022-01-08 20:54:40'),
(176, 219, NULL, NULL, NULL, 'Zunita Anindya Auliya Arzam', NULL, NULL, '09-01-2022', NULL, 'belum', 'belum', NULL, '2022-01-08 21:55:18', '2022-01-08 21:55:18'),
(177, 220, NULL, NULL, NULL, 'Danisa Fitri Aini Lestari', NULL, NULL, '09-01-2022', NULL, 'belum', 'belum', NULL, '2022-01-08 22:05:20', '2022-01-08 22:05:20'),
(178, 221, NULL, NULL, NULL, 'Rahmad Erda Pratama', NULL, NULL, '09-01-2022', NULL, 'belum', 'belum', NULL, '2022-01-08 22:11:35', '2022-01-08 22:11:35'),
(179, 221, 'Offline', 'SMK', NULL, 'Rahmad Erda Pratama', 'Reguler', 'Laki-laki', '09-01-2022', 1000000, 'sudah registrasi', 'belum lunas', NULL, '2022-01-08 22:19:52', '2022-01-08 22:19:52'),
(180, 222, NULL, NULL, NULL, 'Dimas Romadhon Zein', NULL, NULL, '09-01-2022', NULL, 'belum', 'belum', NULL, '2022-01-08 23:52:20', '2022-01-08 23:52:20'),
(181, 223, NULL, NULL, NULL, 'Alfino Garda Pamungkas', NULL, NULL, '09-01-2022', NULL, 'belum', 'belum', NULL, '2022-01-09 00:45:00', '2022-01-09 00:45:00'),
(182, 224, NULL, NULL, NULL, 'ARIF BHEKTI PRASETYO', NULL, NULL, '09-01-2022', NULL, 'belum', 'belum', NULL, '2022-01-09 00:53:42', '2022-01-09 00:53:42'),
(183, 225, NULL, NULL, NULL, 'MUHAMMAD RAMDHANI SUBADRI', NULL, NULL, '09-01-2022', NULL, 'belum', 'belum', NULL, '2022-01-09 00:56:42', '2022-01-09 00:56:42'),
(186, 227, NULL, NULL, NULL, 'AHMAD FAHRI HUSAINI', NULL, NULL, '09-01-2022', NULL, 'belum', 'belum', NULL, '2022-01-09 01:38:38', '2022-01-09 01:38:38'),
(187, 228, NULL, NULL, NULL, 'CINTA HADIANASA', NULL, NULL, '09-01-2022', NULL, 'belum', 'belum', NULL, '2022-01-09 01:51:54', '2022-01-09 01:51:54'),
(188, 229, NULL, NULL, NULL, 'ABID REZA MAHENDRA(ALUMNI)', NULL, NULL, '09-01-2022', NULL, 'belum', 'belum', NULL, '2022-01-09 02:39:56', '2022-01-09 02:39:56'),
(189, 230, NULL, NULL, NULL, 'Rizkia Putri Ramadhani', NULL, NULL, '09-01-2022', NULL, 'belum', 'belum', NULL, '2022-01-09 03:00:47', '2022-01-09 03:00:47'),
(190, 231, NULL, NULL, NULL, 'MUHAMMAD RAIHAN ASYAFI', NULL, NULL, '09-01-2022', NULL, 'belum', 'belum', NULL, '2022-01-09 03:03:44', '2022-01-09 03:03:44'),
(191, 232, NULL, NULL, NULL, 'Nazar Ulya Rohman', NULL, NULL, '09-01-2022', NULL, 'belum', 'belum', NULL, '2022-01-09 03:06:39', '2022-01-09 03:06:39'),
(192, 233, NULL, NULL, NULL, 'M. YUSUF FAAIZ AFRIZI', NULL, NULL, '09-01-2022', NULL, 'belum', 'belum', NULL, '2022-01-09 03:21:25', '2022-01-09 03:21:25'),
(193, 234, NULL, NULL, NULL, 'muhammad rihan asyafi', NULL, NULL, '09-01-2022', NULL, 'belum', 'belum', NULL, '2022-01-09 03:21:30', '2022-01-09 03:21:30'),
(194, 233, 'Offline', 'MTs', NULL, 'M. YUSUF FAAIZ AFRIZI', 'Reguler', 'Laki-laki', '09-01-2022', 2000000, 'sudah registrasi', 'belum lunas', NULL, '2022-01-09 03:27:33', '2022-01-09 03:27:33'),
(195, 235, NULL, NULL, NULL, 'erza dwi rafif', NULL, NULL, '09-01-2022', NULL, 'belum', 'belum', NULL, '2022-01-09 03:28:13', '2022-01-09 03:28:13'),
(196, 236, NULL, NULL, NULL, 'Damar Putra Abimanyu', NULL, NULL, '10-01-2022', NULL, 'belum', 'belum', NULL, '2022-01-09 21:10:50', '2022-01-09 21:10:50'),
(197, 237, NULL, NULL, NULL, 'Ahmad Dzaki Adafa', NULL, NULL, '10-01-2022', NULL, 'belum', 'belum', NULL, '2022-01-09 21:25:07', '2022-01-09 21:25:07'),
(198, 238, NULL, NULL, NULL, 'Adinda Tri Wahyuningsih', NULL, NULL, '10-01-2022', NULL, 'belum', 'belum', NULL, '2022-01-10 00:08:12', '2022-01-10 00:08:12'),
(199, 239, NULL, NULL, NULL, 'Elicia Cherish  Nafisah', NULL, NULL, '10-01-2022', NULL, 'belum', 'belum', NULL, '2022-01-10 01:01:24', '2022-01-10 01:01:24'),
(200, 171, 'Offline', 'MTs', NULL, 'NAHDYA NUR CHOIRINA', 'Reguler', 'Perempuan', '11-01-2022', 2100000, 'angsuran', 'sudah lunas', NULL, '2022-01-10 17:53:36', '2022-01-10 17:53:36'),
(201, 184, 'Offline', 'MA', NULL, 'Safina Syava Felisha', 'Reguler', 'Perempuan', '11-01-2022', 2500000, 'sudah registrasi', 'belum lunas', NULL, '2022-01-10 20:24:40', '2022-01-10 20:24:40'),
(202, 240, NULL, NULL, NULL, 'arifah keysa marcasari', NULL, NULL, '11-01-2022', NULL, 'belum', 'belum', NULL, '2022-01-10 20:40:58', '2022-01-10 20:40:58'),
(203, 241, NULL, NULL, NULL, 'MUHAMMAD RICKY SETIAWAN', NULL, NULL, '11-01-2022', NULL, 'belum', 'belum', NULL, '2022-01-11 01:02:40', '2022-01-11 01:02:40'),
(204, 163, 'Offline', 'MTs', NULL, 'Muchammad Miftaachul Falaach', 'Reguler', 'Laki-laki', '11-01-2022', 3000000, 'sudah registrasi', 'belum lunas', NULL, '2022-01-11 03:12:25', '2022-01-11 03:12:25'),
(205, 242, NULL, NULL, NULL, 'Arina Ifa Manasikana', NULL, NULL, '11-01-2022', NULL, 'belum', 'belum', NULL, '2022-01-11 04:21:46', '2022-01-11 04:21:46'),
(206, 243, NULL, NULL, NULL, 'Arina Ifa Manasikana', NULL, NULL, '11-01-2022', NULL, 'belum', 'belum', NULL, '2022-01-11 04:23:36', '2022-01-11 04:23:36'),
(207, 244, NULL, NULL, NULL, 'Arina Ifa Manasikana', NULL, NULL, '11-01-2022', NULL, 'belum', 'belum', NULL, '2022-01-11 04:27:16', '2022-01-11 04:27:16'),
(208, 163, 'Offline', 'MTs', NULL, 'Muchammad Miftaachul Falaach', 'Reguler', 'Laki-laki', '12-01-2022', 600000, 'angsuran', 'sudah lunas', NULL, '2022-01-11 20:07:35', '2022-01-11 20:07:35'),
(209, 157, 'Offline', 'MTs', NULL, 'Adrean Akhmal Siswanto', 'Non Reguler', 'Laki-laki', '12-01-2022', 6050000, 'sudah registrasi', 'sudah lunas', NULL, '2022-01-12 00:42:48', '2022-01-12 00:42:48'),
(210, 245, NULL, NULL, NULL, 'IZZAN AKBAR NAUFAL HANIF', NULL, NULL, '12-01-2022', NULL, 'belum', 'belum', NULL, '2022-01-12 02:20:10', '2022-01-12 02:20:10'),
(211, 245, 'Offline', 'SMP 1', NULL, 'IZZAN AKBAR NAUFAL HANIF', 'Non Reguler', 'Laki-laki', '12-01-2022', 6050000, 'sudah registrasi', 'sudah lunas', NULL, '2022-01-12 02:47:44', '2022-01-12 02:47:44'),
(212, 176, 'Offline', 'SMP 1', NULL, 'Meyla Atha Athika', 'Non Reguler', 'Perempuan', '13-01-2022', 4550000, 'angsuran', 'sudah lunas', NULL, '2022-01-12 19:58:31', '2022-01-12 19:58:31'),
(213, 246, NULL, NULL, NULL, 'Myiesha Nafeeza Putri', NULL, NULL, '13-01-2022', NULL, 'belum', 'belum', NULL, '2022-01-12 21:47:57', '2022-01-12 21:47:57'),
(214, 247, NULL, NULL, NULL, 'Indah Asna Nafisa', NULL, NULL, '13-01-2022', NULL, 'belum', 'belum', NULL, '2022-01-12 23:02:26', '2022-01-12 23:02:26'),
(215, 248, NULL, NULL, NULL, 'wahid', NULL, NULL, '13-01-2022', NULL, 'belum', 'belum', NULL, '2022-01-12 23:38:02', '2022-01-12 23:38:02'),
(216, 249, NULL, NULL, NULL, 'Indah asna nafisa', NULL, NULL, '13-01-2022', NULL, 'belum', 'belum', NULL, '2022-01-13 00:05:44', '2022-01-13 00:05:44'),
(217, 249, 'Offline', 'MTs', NULL, 'Indah asna nafisa', 'Reguler', 'Perempuan', '13-01-2022', 3600000, 'sudah registrasi', 'sudah lunas', NULL, '2022-01-13 00:09:37', '2022-01-13 00:09:37'),
(218, 250, NULL, NULL, NULL, 'Cinta Nuril Ramadhania', NULL, NULL, '13-01-2022', NULL, 'belum', 'belum', NULL, '2022-01-13 00:45:06', '2022-01-13 00:45:06'),
(219, 251, NULL, NULL, NULL, 'Muh Ibni Hanif Mubarok', NULL, NULL, '13-01-2022', NULL, 'belum', 'belum', NULL, '2022-01-13 03:02:50', '2022-01-13 03:02:50'),
(220, 252, NULL, NULL, NULL, 'MUH.IBNI HAFIDZ LATIFATURROFIK', NULL, NULL, '13-01-2022', NULL, 'belum', 'belum', NULL, '2022-01-13 03:03:03', '2022-01-13 03:03:03'),
(221, 253, NULL, NULL, NULL, 'Nandin Pesti Aulia', NULL, NULL, '13-01-2022', NULL, 'belum', 'belum', NULL, '2022-01-13 05:13:01', '2022-01-13 05:13:01'),
(223, 254, NULL, NULL, NULL, 'Hero Chandra Putra', NULL, NULL, '14-01-2022', NULL, 'belum', 'belum', NULL, '2022-01-14 00:10:58', '2022-01-14 00:10:58'),
(224, 255, NULL, NULL, NULL, 'MIFTAH FATIHAH AZZAHRA', NULL, NULL, '14-01-2022', NULL, 'belum', 'belum', NULL, '2022-01-14 00:28:45', '2022-01-14 00:28:45'),
(225, 151, 'Offline', 'MA', NULL, 'Anindya Putri Rahmawati', 'Non Reguler', 'Perempuan', '15-01-2022', 3100000, 'sudah registrasi', 'belum lunas', NULL, '2022-01-14 18:10:09', '2022-01-14 18:10:09'),
(226, 256, NULL, NULL, NULL, 'adelia sarafina ekameka', NULL, NULL, '15-01-2022', NULL, 'belum', 'belum', NULL, '2022-01-14 19:16:07', '2022-01-14 19:16:07'),
(228, 257, NULL, NULL, NULL, 'GHIPA SHENO APRIAMA', NULL, NULL, '15-01-2022', NULL, 'belum', 'belum', NULL, '2022-01-14 20:36:59', '2022-01-14 20:36:59'),
(229, 137, 'Offline', 'MTs', NULL, 'DANISWARA NAUFAL ARIQ', 'Non Reguler', 'Laki-laki', '15-01-2022', 2000000, 'sudah registrasi', '-- Pilih --', NULL, '2022-01-14 21:12:07', '2022-01-14 21:12:07'),
(230, 258, NULL, NULL, NULL, 'Ulayya Safa Sabita', NULL, NULL, '15-01-2022', NULL, 'belum', 'belum', NULL, '2022-01-14 23:39:23', '2022-01-14 23:39:23'),
(231, 201, 'Online', 'MA', NULL, 'Hably Arkan el Hady', 'Non Reguler', 'Laki-laki', '15-01-2022', 3500000, 'sudah registrasi', 'belum lunas', NULL, '2022-01-14 23:41:14', '2022-01-14 23:41:14'),
(232, 259, NULL, NULL, NULL, 'Nandin Pesti Aulia', NULL, NULL, '15-01-2022', NULL, 'belum', 'belum', NULL, '2022-01-15 05:17:53', '2022-01-15 05:17:53'),
(233, 260, NULL, NULL, NULL, 'Silvie Novie Adhesya', NULL, NULL, '16-01-2022', NULL, 'belum', 'belum', NULL, '2022-01-15 19:28:37', '2022-01-15 19:28:37'),
(234, 261, NULL, NULL, NULL, 'Nabila Lailatusifah', NULL, NULL, '16-01-2022', NULL, 'belum', 'belum', NULL, '2022-01-15 19:34:50', '2022-01-15 19:34:50'),
(235, 262, NULL, NULL, NULL, 'Bunga Rachma Safitri', NULL, NULL, '16-01-2022', NULL, 'belum', 'belum', NULL, '2022-01-15 19:50:34', '2022-01-15 19:50:34'),
(236, 263, NULL, NULL, NULL, 'Dwi Aditya Saputra', NULL, NULL, '16-01-2022', NULL, 'belum', 'belum', NULL, '2022-01-15 19:52:35', '2022-01-15 19:52:35'),
(237, 215, 'Offline', 'SMP 1', NULL, 'Bambang setiawan', 'Non Reguler', 'Laki-laki', '16-01-2022', 3000000, 'sudah registrasi', 'belum lunas', NULL, '2022-01-15 19:58:59', '2022-01-15 19:58:59'),
(239, 262, 'Offline', 'SMP 1', NULL, 'Bunga Rachma Safitri', 'Reguler', 'Perempuan', '16-01-2022', 2000000, 'sudah registrasi', 'belum lunas', NULL, '2022-01-15 20:15:28', '2022-01-15 20:15:28'),
(240, 264, NULL, NULL, NULL, 'Shilla Nadifa', NULL, NULL, '16-01-2022', NULL, 'belum', 'belum', NULL, '2022-01-15 20:28:48', '2022-01-15 20:28:48'),
(241, 265, NULL, NULL, NULL, 'Lutfiatul Shifa Yafiah', NULL, NULL, '16-01-2022', NULL, 'belum', 'belum', NULL, '2022-01-15 20:47:28', '2022-01-15 20:47:28'),
(242, 264, 'Offline', 'MTs', NULL, 'Shilla Nadifa', 'Reguler', 'Perempuan', '16-01-2022', 300000, 'sudah registrasi', 'belum lunas', NULL, '2022-01-15 20:55:50', '2022-01-15 20:55:50'),
(243, 266, NULL, NULL, NULL, 'Raffasya Naufal Nur Ramadhan', NULL, NULL, '16-01-2022', NULL, 'belum', 'belum', NULL, '2022-01-15 21:34:52', '2022-01-15 21:34:52'),
(244, 267, NULL, NULL, NULL, 'Muhammad Farel Radiqta Raihan', NULL, NULL, '16-01-2022', NULL, 'belum', 'belum', NULL, '2022-01-15 22:15:12', '2022-01-15 22:15:12'),
(245, 268, NULL, NULL, NULL, 'Cinta Ashlahayu Rahmania', NULL, NULL, '16-01-2022', NULL, 'belum', 'belum', NULL, '2022-01-15 22:27:33', '2022-01-15 22:27:33'),
(246, 269, NULL, NULL, NULL, 'Aysilla Zaneta Aurora', NULL, NULL, '16-01-2022', NULL, 'belum', 'belum', NULL, '2022-01-15 23:13:45', '2022-01-15 23:13:45'),
(247, 270, NULL, NULL, NULL, 'Muhammad Nurullah Tamim', NULL, NULL, '16-01-2022', NULL, 'belum', 'belum', NULL, '2022-01-16 01:58:42', '2022-01-16 01:58:42'),
(248, 156, 'Offline', 'MTs', NULL, 'Ardi Brilliant Martaretta Pradani', 'Non Reguler', 'Perempuan', '17-01-2022', 3000000, 'sudah registrasi', 'belum lunas', NULL, '2022-01-16 20:04:03', '2022-01-16 20:04:03'),
(249, 271, NULL, NULL, NULL, 'RAFA SETYA ROSELANI', NULL, NULL, '17-01-2022', NULL, 'belum', 'belum', NULL, '2022-01-16 20:41:41', '2022-01-16 20:41:41'),
(250, 272, NULL, NULL, NULL, 'Sheifa Asabilla Rizqi', NULL, NULL, '17-01-2022', NULL, 'belum', 'belum', NULL, '2022-01-16 21:52:07', '2022-01-16 21:52:07'),
(251, 183, 'Online', 'SMP 1', NULL, 'ALYSA VANESSIANSYAH SAPUTRI', 'Reguler', 'Perempuan', '17-01-2022', 2000000, 'sudah registrasi', 'belum lunas', NULL, '2022-01-17 00:26:16', '2022-01-17 00:26:16'),
(252, 273, NULL, NULL, NULL, 'Anis Silvi Ani', NULL, NULL, '17-01-2022', NULL, 'belum', 'belum', NULL, '2022-01-17 01:49:46', '2022-01-17 01:49:46'),
(253, 274, NULL, NULL, NULL, 'Aprilian Hendi Pratama', NULL, NULL, '17-01-2022', NULL, 'belum', 'belum', NULL, '2022-01-17 01:55:05', '2022-01-17 01:55:05'),
(254, 275, NULL, NULL, NULL, 'Revan Cahaya Ramadhan', NULL, NULL, '17-01-2022', NULL, 'belum', 'belum', NULL, '2022-01-17 02:10:29', '2022-01-17 02:10:29'),
(255, 273, 'Offline', 'SMP 1', NULL, 'Anis Silvi Ani', 'Reguler', 'Perempuan', '17-01-2022', 2500000, 'sudah registrasi', 'belum lunas', NULL, '2022-01-17 02:45:49', '2022-01-17 02:45:49'),
(256, 236, 'Offline', 'SMP 1', NULL, 'Damar Putra Abimanyu', 'Reguler', 'Laki-laki', '18-01-2022', 3600000, 'sudah registrasi', 'sudah lunas', NULL, '2022-01-17 18:09:57', '2022-01-17 18:09:57'),
(257, 197, 'Online', 'SMP 1', NULL, 'Gian Rafif Rayhan Wahyudi', 'Non Reguler', 'Laki-laki', '18-01-2022', 3000000, 'sudah registrasi', 'belum lunas', NULL, '2022-01-17 18:11:39', '2022-01-17 18:11:39'),
(258, 139, 'Online', 'SMP 1', NULL, 'SANSA ADHWAA MAULIDA', 'Non Reguler', 'Perempuan', '18-01-2022', 3300000, 'sudah registrasi', 'belum lunas', NULL, '2022-01-17 18:12:30', '2022-01-17 18:12:30'),
(259, 237, 'Offline', 'SMP 1', NULL, 'Ahmad Dzaki Adafa', 'Reguler', 'Laki-laki', '18-01-2022', 3600000, 'sudah registrasi', 'sudah lunas', NULL, '2022-01-17 23:44:40', '2022-01-17 23:44:40'),
(260, 276, NULL, NULL, NULL, 'Alisa Fidelya', NULL, NULL, '18-01-2022', NULL, 'belum', 'belum', NULL, '2022-01-18 00:44:41', '2022-01-18 00:44:41'),
(261, 277, NULL, NULL, NULL, 'Ahmad dzaki adafa', NULL, NULL, '18-01-2022', NULL, 'belum', 'belum', NULL, '2022-01-18 08:49:32', '2022-01-18 08:49:32'),
(262, 278, NULL, NULL, NULL, 'Ahmad dzaki adafa', NULL, NULL, '18-01-2022', NULL, 'belum', 'belum', NULL, '2022-01-18 08:50:00', '2022-01-18 08:50:00'),
(263, 279, NULL, NULL, NULL, 'NURRAYA SYAUQIA ALTHAFUNNISA', NULL, NULL, '19-01-2022', NULL, 'belum', 'belum', NULL, '2022-01-18 19:48:08', '2022-01-18 19:48:08'),
(265, 281, NULL, NULL, NULL, 'RISQI YUDA ATMAJA', NULL, NULL, '19-01-2022', NULL, 'belum', 'belum', NULL, '2022-01-18 20:16:01', '2022-01-18 20:16:01'),
(266, 282, NULL, NULL, NULL, 'RISQI YUDA ATMAJA', NULL, NULL, '19-01-2022', NULL, 'belum', 'belum', NULL, '2022-01-18 20:16:01', '2022-01-18 20:16:01'),
(268, 280, 'Offline', 'SMP 1', NULL, 'AULIA SAFINATUNNAJAH', 'Non Reguler', 'Perempuan', '19-01-2022', 6050000, 'sudah registrasi', 'sudah lunas', NULL, '2022-01-18 20:21:54', '2022-01-18 20:21:54'),
(269, 283, NULL, NULL, NULL, 'NIMAS KUSNI SASMITA', NULL, NULL, '19-01-2022', NULL, 'belum', 'belum', NULL, '2022-01-18 20:34:43', '2022-01-18 20:34:43'),
(270, 221, 'Offline', 'SMK', NULL, 'Rahmad Erda Pratama', 'Reguler', 'Laki-laki', '19-01-2022', 1000000, 'angsuran', 'belum lunas', NULL, '2022-01-19 01:19:00', '2022-01-19 01:19:00'),
(271, 284, NULL, NULL, NULL, 'ARTIKA RATRI SETIYA NINGRUM', NULL, NULL, '20-01-2022', NULL, 'belum', 'belum', NULL, '2022-01-19 20:48:44', '2022-01-19 20:48:44'),
(272, 284, 'Offline', 'MA', NULL, 'ARTIKA RATRI SETIYA NINGRUM', 'Reguler', 'Perempuan', '20-01-2022', 2700000, 'sudah registrasi', 'sudah lunas', NULL, '2022-01-19 20:51:19', '2022-01-19 20:51:19'),
(273, 285, NULL, NULL, NULL, 'EMAURA ANISA AULIA', NULL, NULL, '20-01-2022', NULL, 'belum', 'belum', NULL, '2022-01-20 00:15:38', '2022-01-20 00:15:38'),
(274, 286, NULL, NULL, NULL, 'Arina Ifa Manasikana', NULL, NULL, '21-01-2022', NULL, 'belum', 'belum', NULL, '2022-01-20 20:22:18', '2022-01-20 20:22:18'),
(275, 287, NULL, NULL, NULL, 'Isna Dhaqiyatul Fasikhah', NULL, NULL, '21-01-2022', NULL, 'belum', 'belum', NULL, '2022-01-21 00:57:35', '2022-01-21 00:57:35'),
(276, 287, 'Offline', 'SMP 1', NULL, 'Isna Dhaqiyatul Fasikhah', 'Reguler', 'Perempuan', '21-01-2022', 1200000, 'sudah registrasi', 'belum lunas', NULL, '2022-01-21 01:02:00', '2022-01-21 01:02:00'),
(277, 288, NULL, NULL, NULL, 'Zidny Fauziyah', NULL, NULL, '21-01-2022', NULL, 'belum', 'belum', NULL, '2022-01-21 02:56:57', '2022-01-21 02:56:57'),
(278, 289, NULL, NULL, NULL, 'wama arfa khalfani', NULL, NULL, '22-01-2022', NULL, 'belum', 'belum', NULL, '2022-01-21 18:10:43', '2022-01-21 18:10:43'),
(279, 144, 'Online', 'MA', NULL, 'Nayla Aninda Salwa', 'Reguler', 'Perempuan', '22-01-2022', 3650000, 'sudah registrasi', 'sudah lunas', NULL, '2022-01-21 19:35:54', '2022-01-21 19:35:54'),
(280, 174, 'Offline', 'MA', NULL, 'Alfiana Reza Rahmadhani', 'Non Reguler', 'Perempuan', '22-01-2022', 2000000, 'sudah registrasi', 'belum lunas', NULL, '2022-01-21 20:04:06', '2022-01-21 20:04:06'),
(281, 290, NULL, NULL, NULL, 'Misyael Najma Ramadhani', NULL, NULL, '22-01-2022', NULL, 'belum', 'belum', NULL, '2022-01-22 01:12:44', '2022-01-22 01:12:44'),
(282, 291, NULL, NULL, NULL, 'Misyael Najma Ramadhani', NULL, NULL, '22-01-2022', NULL, 'belum', 'belum', NULL, '2022-01-22 01:12:44', '2022-01-22 01:12:44'),
(283, 292, NULL, NULL, NULL, 'Nabiilah Aqiilah Rismawati', NULL, NULL, '22-01-2022', NULL, 'belum', 'belum', NULL, '2022-01-22 01:25:30', '2022-01-22 01:25:30'),
(284, 293, NULL, NULL, NULL, 'ANDITRA HILAL ABIYU JAMAIL', NULL, NULL, '22-01-2022', NULL, 'belum', 'belum', NULL, '2022-01-22 01:51:05', '2022-01-22 01:51:05'),
(285, 294, NULL, NULL, NULL, 'SHAFA AHMAD TSAQIF', NULL, NULL, '22-01-2022', NULL, 'belum', 'belum', NULL, '2022-01-22 02:38:47', '2022-01-22 02:38:47'),
(286, 294, 'Offline', 'SMK', NULL, 'SHAFA AHMAD TSAQIF', 'Non Reguler', 'Laki-laki', '22-01-2022', 6350000, 'sudah registrasi', 'sudah lunas', NULL, '2022-01-22 03:06:29', '2022-01-22 03:06:29'),
(288, 216, 'Offline', 'SMP 1', NULL, 'Rizkia Cantika Putri Prasetyanto', 'Reguler', 'Perempuan', '23-01-2022', 1700000, 'sudah registrasi', '-- Pilih --', NULL, '2022-01-22 18:29:41', '2022-01-22 18:29:41'),
(289, 295, NULL, NULL, NULL, 'ZALFA AULIA MARSHA', NULL, NULL, '23-01-2022', NULL, 'belum', 'belum', NULL, '2022-01-22 18:55:00', '2022-01-22 18:55:00'),
(290, 296, NULL, NULL, NULL, 'ZALFA AULIA MARSHA', NULL, NULL, '23-01-2022', NULL, 'belum', 'belum', NULL, '2022-01-22 19:04:52', '2022-01-22 19:04:52'),
(291, 297, NULL, NULL, NULL, 'Nadia Putri Nurwanda', NULL, NULL, '23-01-2022', NULL, 'belum', 'belum', NULL, '2022-01-22 19:18:11', '2022-01-22 19:18:11'),
(293, 219, 'Offline', 'SMP 1', NULL, 'Zunita Anindya Auliya Arzam', 'Non Reguler', 'Perempuan', '23-01-2022', 3050000, 'sudah registrasi', 'belum lunas', NULL, '2022-01-22 19:40:59', '2022-01-22 19:40:59'),
(294, 298, NULL, NULL, NULL, 'Alya Syafaqun Nur', NULL, NULL, '23-01-2022', NULL, 'belum', 'belum', NULL, '2022-01-22 19:53:10', '2022-01-22 19:53:10'),
(295, 297, 'Offline', 'SMP 1', NULL, 'Nadia Putri Nurwanda', 'Non Reguler', 'Perempuan', '23-01-2022', 2000000, 'sudah registrasi', 'belum lunas', NULL, '2022-01-22 19:54:32', '2022-01-22 19:54:32'),
(296, 299, NULL, NULL, NULL, 'FITRIANA NUR DWI LESTARI', NULL, NULL, '23-01-2022', NULL, 'belum', 'belum', NULL, '2022-01-22 20:09:49', '2022-01-22 20:09:49'),
(297, 300, NULL, NULL, NULL, 'DEVI EKO MAULINA', NULL, NULL, '23-01-2022', NULL, 'belum', 'belum', NULL, '2022-01-22 20:22:30', '2022-01-22 20:22:30'),
(298, 301, NULL, NULL, NULL, 'Amin Mubarok', NULL, NULL, '23-01-2022', NULL, 'belum', 'belum', NULL, '2022-01-22 20:29:17', '2022-01-22 20:29:17'),
(299, 301, 'Offline', 'MA', NULL, 'Amin Mubarok', 'Reguler', 'Laki-laki', '23-01-2022', 2900000, 'sudah registrasi', 'sudah lunas', NULL, '2022-01-22 20:33:51', '2022-01-22 20:33:51'),
(300, 302, NULL, NULL, NULL, 'YUNIAR FIRSTGIFTA MUTIKA KASYADI', NULL, NULL, '23-01-2022', NULL, 'belum', 'belum', NULL, '2022-01-22 20:35:13', '2022-01-22 20:35:13'),
(301, 303, NULL, NULL, NULL, 'Putria Ema Aulianissa', NULL, NULL, '23-01-2022', NULL, 'belum', 'belum', NULL, '2022-01-22 20:44:33', '2022-01-22 20:44:33'),
(302, 303, 'Offline', 'SMK', NULL, 'Putria Ema Aulianissa', 'Reguler', 'Perempuan', '23-01-2022', 2000000, 'sudah registrasi', 'belum lunas', NULL, '2022-01-22 20:48:50', '2022-01-22 20:48:50'),
(303, 300, 'Offline', 'MTs', NULL, 'DEVI EKO MAULINA', 'Reguler', 'Perempuan', '23-01-2022', 500000, 'sudah registrasi', 'belum lunas', NULL, '2022-01-22 21:01:43', '2022-01-22 21:01:43'),
(304, 302, 'Offline', 'MTs', NULL, 'YUNIAR FIRSTGIFTA MUTIKA KASYADI', 'Reguler', 'Perempuan', '23-01-2022', 500000, 'sudah registrasi', 'belum lunas', NULL, '2022-01-22 21:08:51', '2022-01-22 21:08:51'),
(305, 304, NULL, NULL, NULL, 'YASMIN NURUL HUDA', NULL, NULL, '23-01-2022', NULL, 'belum', 'belum', NULL, '2022-01-22 21:17:12', '2022-01-22 21:17:12'),
(306, 305, NULL, NULL, NULL, 'Jovilana Pratama Heni Sulistiyono', NULL, NULL, '23-01-2022', NULL, 'belum', 'belum', NULL, '2022-01-22 21:25:57', '2022-01-22 21:25:57'),
(307, 306, NULL, NULL, NULL, 'GILANG ARFANA PUTRA', NULL, NULL, '23-01-2022', NULL, 'belum', 'belum', NULL, '2022-01-22 21:30:27', '2022-01-22 21:30:27'),
(308, 307, NULL, NULL, NULL, 'MUHAMAD YUSUF AFRIZA', NULL, NULL, '23-01-2022', NULL, 'belum', 'belum', NULL, '2022-01-22 21:45:13', '2022-01-22 21:45:13'),
(309, 308, NULL, NULL, NULL, 'Ananda Rismawati', NULL, NULL, '23-01-2022', NULL, 'belum', 'belum', NULL, '2022-01-22 21:53:35', '2022-01-22 21:53:35'),
(310, 309, NULL, NULL, NULL, 'GHAITSA HASNA DIEN', NULL, NULL, '23-01-2022', NULL, 'belum', 'belum', NULL, '2022-01-22 22:04:43', '2022-01-22 22:04:43'),
(311, 310, NULL, NULL, NULL, 'Asyam Fatah Mubarok', NULL, NULL, '23-01-2022', NULL, 'belum', 'belum', NULL, '2022-01-22 22:11:40', '2022-01-22 22:11:40'),
(312, 311, NULL, NULL, NULL, 'Wildan Syafif Akmaludin', NULL, NULL, '23-01-2022', NULL, 'belum', 'belum', NULL, '2022-01-22 23:16:38', '2022-01-22 23:16:38'),
(313, 312, NULL, NULL, NULL, 'Ahmad Tirta Nur Fauzan', NULL, NULL, '23-01-2022', NULL, 'belum', 'belum', NULL, '2022-01-22 23:17:49', '2022-01-22 23:17:49'),
(314, 313, NULL, NULL, NULL, 'Khansa Tabita Sakhi', NULL, NULL, '23-01-2022', NULL, 'belum', 'belum', NULL, '2022-01-22 23:32:38', '2022-01-22 23:32:38'),
(315, 314, NULL, NULL, NULL, 'Rafi Putra Maheswara', NULL, NULL, '23-01-2022', NULL, 'belum', 'belum', NULL, '2022-01-22 23:42:13', '2022-01-22 23:42:13'),
(316, 315, NULL, NULL, NULL, 'Zalfa Aulia  Marsya', NULL, NULL, '23-01-2022', NULL, 'belum', 'belum', NULL, '2022-01-22 23:44:24', '2022-01-22 23:44:24'),
(318, 312, 'Offline', 'SMP 1', NULL, 'Ahmad Tirta Nur Fauzan', 'Reguler', 'Laki-laki', '23-01-2022', 1000000, 'sudah registrasi', 'belum lunas', NULL, '2022-01-23 00:04:09', '2022-01-23 00:04:09'),
(319, 286, 'Offline', 'SMK', NULL, 'Arina Ifa Manasikana', 'Reguler', 'Perempuan', '23-01-2022', 1950000, 'sudah registrasi', 'belum lunas', NULL, '2022-01-23 00:12:57', '2022-01-23 00:12:57'),
(320, 317, NULL, NULL, NULL, 'Baihaqi Charish Maula', NULL, NULL, '23-01-2022', NULL, 'belum', 'belum', NULL, '2022-01-23 00:27:36', '2022-01-23 00:27:36'),
(321, 318, NULL, NULL, NULL, 'Amira Maylani munif', NULL, NULL, '23-01-2022', NULL, 'belum', 'belum', NULL, '2022-01-23 00:50:02', '2022-01-23 00:50:02'),
(322, 319, NULL, NULL, NULL, 'Alika Zelda Chairunnisa', NULL, NULL, '23-01-2022', NULL, 'belum', 'belum', NULL, '2022-01-23 00:52:36', '2022-01-23 00:52:36'),
(323, 311, 'Offline', 'SMP 1', NULL, 'Wildan Syafif Akmaludin', 'Reguler', 'Laki-laki', '23-01-2022', 3000000, 'sudah registrasi', 'belum lunas', NULL, '2022-01-23 01:05:17', '2022-01-23 01:05:17'),
(324, 320, NULL, NULL, NULL, 'Muhammad Pandu Alfatah', NULL, NULL, '23-01-2022', NULL, 'belum', 'belum', NULL, '2022-01-23 01:12:25', '2022-01-23 01:12:25'),
(325, 318, 'Offline', 'SMP 1', NULL, 'Almira Maylani munif', 'Reguler', 'Laki-laki', '23-01-2022', 1600000, 'sudah registrasi', 'belum lunas', NULL, '2022-01-23 01:21:35', '2022-01-23 01:21:35'),
(326, 321, NULL, NULL, NULL, 'Damar Wasisto', NULL, NULL, '23-01-2022', NULL, 'belum', 'belum', NULL, '2022-01-23 01:24:20', '2022-01-23 01:24:20'),
(327, 322, NULL, NULL, NULL, 'Salsabila Nurita Ati Wibowo', NULL, NULL, '23-01-2022', NULL, 'belum', 'belum', NULL, '2022-01-23 01:30:15', '2022-01-23 01:30:15'),
(328, 323, NULL, NULL, NULL, 'Tities Arum Hidayah', NULL, NULL, '23-01-2022', NULL, 'belum', 'belum', NULL, '2022-01-23 02:27:06', '2022-01-23 02:27:06'),
(329, 324, NULL, NULL, NULL, 'Rosita maulida', NULL, NULL, '23-01-2022', NULL, 'belum', 'belum', NULL, '2022-01-23 02:31:41', '2022-01-23 02:31:41'),
(330, 325, NULL, NULL, NULL, 'UUN KURNIASIH', NULL, NULL, '24-01-2022', NULL, 'belum', 'belum', NULL, '2022-01-23 20:30:42', '2022-01-23 20:30:42'),
(331, 239, 'Offline', 'SMP 1', NULL, 'Elicia Cherish  Nafisah', 'Reguler', 'Perempuan', '24-01-2022', 1500000, 'sudah registrasi', 'belum lunas', NULL, '2022-01-23 21:43:12', '2022-01-23 21:43:12'),
(332, 132, 'Offline', 'SMK', NULL, 'Fatikha kurnia zoughbi', 'Non Reguler', 'Perempuan', '24-01-2022', 2000000, 'sudah registrasi', 'belum lunas', NULL, '2022-01-23 21:50:26', '2022-01-23 21:50:26'),
(333, 326, NULL, NULL, NULL, 'SYAFIRA ASHA RAHMA KHALYANI', NULL, NULL, '24-01-2022', NULL, 'belum', 'belum', NULL, '2022-01-24 15:43:36', '2022-01-24 15:43:36'),
(334, 327, NULL, NULL, NULL, 'Raditya Alvinza Kakhna Saputra', NULL, NULL, '25-01-2022', NULL, 'belum', 'belum', NULL, '2022-01-24 23:32:59', '2022-01-24 23:32:59'),
(335, 328, NULL, NULL, NULL, 'MASNA LUTHFI HAIKAL', NULL, NULL, '25-01-2022', NULL, 'belum', 'belum', NULL, '2022-01-24 23:55:35', '2022-01-24 23:55:35'),
(336, 329, NULL, NULL, NULL, 'ZIDAN AGIEL FARISKI', NULL, NULL, '25-01-2022', NULL, 'belum', 'belum', NULL, '2022-01-25 00:02:33', '2022-01-25 00:02:33'),
(337, 327, 'Offline', 'SMP 1', NULL, 'Raditya Alvinza Kakhna Saputra', 'Non Reguler', 'Laki-laki', '25-01-2022', 5850000, 'sudah registrasi', 'belum lunas', NULL, '2022-01-25 00:20:22', '2022-01-25 00:20:22'),
(338, 330, NULL, NULL, NULL, 'AHMAD DIPPO NUGROHO', NULL, NULL, '25-01-2022', NULL, 'belum', 'belum', NULL, '2022-01-25 00:29:48', '2022-01-25 00:29:48'),
(339, 331, NULL, NULL, NULL, 'MUHAMMAD DAVI ALANUF', NULL, NULL, '25-01-2022', NULL, 'belum', 'belum', NULL, '2022-01-25 00:33:57', '2022-01-25 00:33:57'),
(340, 332, NULL, NULL, NULL, 'AMELIA CAHYARANI', NULL, NULL, '25-01-2022', NULL, 'belum', 'belum', NULL, '2022-01-25 00:37:02', '2022-01-25 00:37:02'),
(341, 333, NULL, NULL, NULL, 'Alqira Keylyla Qifara', NULL, NULL, '25-01-2022', NULL, 'belum', 'belum', NULL, '2022-01-25 09:03:50', '2022-01-25 09:03:50'),
(342, 334, NULL, NULL, NULL, 'Alqira Keylyla Qifara', NULL, NULL, '25-01-2022', NULL, 'belum', 'belum', NULL, '2022-01-25 09:03:50', '2022-01-25 09:03:50'),
(343, 335, NULL, NULL, NULL, 'Alqira Keylyla Qifara', NULL, NULL, '25-01-2022', NULL, 'belum', 'belum', NULL, '2022-01-25 09:03:50', '2022-01-25 09:03:50'),
(344, 336, NULL, NULL, NULL, 'Alqira Keylyla Qifara', NULL, NULL, '25-01-2022', NULL, 'belum', 'belum', NULL, '2022-01-25 09:03:50', '2022-01-25 09:03:50'),
(345, 337, NULL, NULL, NULL, 'Alqira Keylyla Qifara', NULL, NULL, '25-01-2022', NULL, 'belum', 'belum', NULL, '2022-01-25 09:06:34', '2022-01-25 09:06:34'),
(346, 338, NULL, NULL, NULL, 'silmy nailufar salam', NULL, NULL, '26-01-2022', NULL, 'belum', 'belum', NULL, '2022-01-25 19:56:05', '2022-01-25 19:56:05'),
(347, 307, 'Offline', 'SMP 1', NULL, 'MUHAMAD YUSUF AFRIZA', 'Reguler', 'Laki-laki', '26-01-2022', 1500000, 'sudah registrasi', 'belum lunas', NULL, '2022-01-25 19:58:26', '2022-01-25 19:58:26'),
(348, 339, NULL, NULL, NULL, 'ana sofitiyani', NULL, NULL, '26-01-2022', NULL, 'belum', 'belum', NULL, '2022-01-25 20:04:34', '2022-01-25 20:04:34'),
(349, 340, NULL, NULL, NULL, 'selvia chalisa', NULL, NULL, '26-01-2022', NULL, 'belum', 'belum', NULL, '2022-01-25 20:11:55', '2022-01-25 20:11:55'),
(350, 341, NULL, NULL, NULL, 'serinta jeni anggraeni', NULL, NULL, '26-01-2022', NULL, 'belum', 'belum', NULL, '2022-01-25 20:17:40', '2022-01-25 20:17:40'),
(351, 342, NULL, NULL, NULL, 'aisyah putrirama pratidina', NULL, NULL, '26-01-2022', NULL, 'belum', 'belum', NULL, '2022-01-25 20:21:39', '2022-01-25 20:21:39'),
(352, 343, NULL, NULL, NULL, 'aisyah putrirama pratidina', NULL, NULL, '26-01-2022', NULL, 'belum', 'belum', NULL, '2022-01-25 20:22:28', '2022-01-25 20:22:28'),
(353, 344, NULL, NULL, NULL, 'aisyah putrirama pratidina', NULL, NULL, '26-01-2022', NULL, 'belum', 'belum', NULL, '2022-01-25 20:24:21', '2022-01-25 20:24:21'),
(354, 345, NULL, NULL, NULL, 'dela muarifah', NULL, NULL, '26-01-2022', NULL, 'belum', 'belum', NULL, '2022-01-25 20:26:53', '2022-01-25 20:26:53'),
(355, 346, NULL, NULL, NULL, 'dela muarifah', NULL, NULL, '26-01-2022', NULL, 'belum', 'belum', NULL, '2022-01-25 20:28:42', '2022-01-25 20:28:42'),
(356, 347, NULL, NULL, NULL, 'dela muarifah', NULL, NULL, '26-01-2022', NULL, 'belum', 'belum', NULL, '2022-01-25 20:28:45', '2022-01-25 20:28:45'),
(357, 348, NULL, NULL, NULL, 'Dela Muarifah', NULL, NULL, '26-01-2022', NULL, 'belum', 'belum', NULL, '2022-01-25 20:37:03', '2022-01-25 20:37:03'),
(358, 349, NULL, NULL, NULL, 'Najwa Dewi Azzahra', NULL, NULL, '26-01-2022', NULL, 'belum', 'belum', NULL, '2022-01-25 20:44:14', '2022-01-25 20:44:14'),
(359, 350, NULL, NULL, NULL, 'Nungki Fajrin Safarida', NULL, NULL, '26-01-2022', NULL, 'belum', 'belum', NULL, '2022-01-25 20:49:40', '2022-01-25 20:49:40'),
(360, 351, NULL, NULL, NULL, 'FARAH FAUZIYAH SHIHAB', NULL, NULL, '26-01-2022', NULL, 'belum', 'belum', NULL, '2022-01-25 20:55:21', '2022-01-25 20:55:21'),
(361, 352, NULL, NULL, NULL, 'Nova Ifatun Nabila', NULL, NULL, '26-01-2022', NULL, 'belum', 'belum', NULL, '2022-01-25 21:03:13', '2022-01-25 21:03:13'),
(363, 354, NULL, NULL, NULL, 'FIRSTYANE ANGGUN SELIKA', NULL, NULL, '26-01-2022', NULL, 'belum', 'belum', NULL, '2022-01-25 21:21:28', '2022-01-25 21:21:28'),
(364, 355, NULL, NULL, NULL, 'MAFTUCHAH ULIN NIHAYATI', NULL, NULL, '26-01-2022', NULL, 'belum', 'belum', NULL, '2022-01-25 21:27:20', '2022-01-25 21:27:20'),
(365, 356, NULL, NULL, NULL, 'GIGGSY NAYLA AKHOLIK', NULL, NULL, '26-01-2022', NULL, 'belum', 'belum', NULL, '2022-01-25 21:33:02', '2022-01-25 21:33:02'),
(366, 357, NULL, NULL, NULL, 'SABILA KHOIRUNNISA SYAFITRI', NULL, NULL, '26-01-2022', NULL, 'belum', 'belum', NULL, '2022-01-25 21:39:25', '2022-01-25 21:39:25'),
(367, 358, NULL, NULL, NULL, 'ANJA HILDA UDLIYA', NULL, NULL, '26-01-2022', NULL, 'belum', 'belum', NULL, '2022-01-25 21:46:32', '2022-01-25 21:46:32'),
(368, 359, NULL, NULL, NULL, 'ALFINA ZAHRA NURAINI', NULL, NULL, '26-01-2022', NULL, 'belum', 'belum', NULL, '2022-01-25 21:53:57', '2022-01-25 21:53:57'),
(369, 360, NULL, NULL, NULL, 'FANIA NOVITASARI', NULL, NULL, '26-01-2022', NULL, 'belum', 'belum', NULL, '2022-01-25 22:01:39', '2022-01-25 22:01:39'),
(370, 361, NULL, NULL, NULL, 'Medin Kusuma Wardani', NULL, NULL, '26-01-2022', NULL, 'belum', 'belum', NULL, '2022-01-25 23:20:53', '2022-01-25 23:20:53'),
(371, 362, NULL, NULL, NULL, 'M Hanan Dani Abqori', NULL, NULL, '26-01-2022', NULL, 'belum', 'belum', NULL, '2022-01-26 00:37:53', '2022-01-26 00:37:53'),
(372, 363, NULL, NULL, NULL, 'Neila Dias Pangesti', NULL, NULL, '26-01-2022', NULL, 'belum', 'belum', NULL, '2022-01-26 01:04:57', '2022-01-26 01:04:57'),
(373, 364, NULL, NULL, NULL, 'Afrizal Anwar Zulfani', NULL, NULL, '26-01-2022', NULL, 'belum', 'belum', NULL, '2022-01-26 01:21:39', '2022-01-26 01:21:39'),
(374, 365, NULL, NULL, NULL, 'Alief Danar Maulid', NULL, NULL, '26-01-2022', NULL, 'belum', 'belum', NULL, '2022-01-26 01:27:29', '2022-01-26 01:27:29'),
(375, 366, NULL, NULL, NULL, 'AHMAD ZURI ARDIYANSYAH', NULL, NULL, '26-01-2022', NULL, 'belum', 'belum', NULL, '2022-01-26 01:32:56', '2022-01-26 01:32:56'),
(377, 269, 'Offline', 'SMP 1', NULL, 'Aysilla Zaneta Aurora', 'Reguler', 'Perempuan', '26-01-2022', 1800000, 'sudah registrasi', 'belum lunas', NULL, '2022-01-26 07:29:59', '2022-01-26 07:29:59'),
(378, 140, 'Offline', 'MTs', NULL, 'Naura  Zalfa Khansa', 'Reguler', 'Perempuan', '26-01-2022', 1800000, 'sudah registrasi', 'belum lunas', NULL, '2022-01-26 07:35:40', '2022-01-26 07:35:40'),
(379, 241, 'Offline', 'MA', NULL, 'MUHAMMAD RICKY SETIAWAN', 'Reguler', 'Laki-laki', '26-01-2022', 2700000, 'sudah registrasi', 'sudah lunas', NULL, '2022-01-26 07:41:52', '2022-01-26 07:41:52'),
(380, 367, NULL, NULL, NULL, 'Nafisah Rodliyatul Fauziah', NULL, NULL, '27-01-2022', NULL, 'belum', 'belum', NULL, '2022-01-26 18:58:24', '2022-01-26 18:58:24'),
(381, 368, NULL, NULL, NULL, 'KEISYA AIDI MELLINDA', NULL, NULL, '27-01-2022', NULL, 'belum', 'belum', NULL, '2022-01-26 23:15:34', '2022-01-26 23:15:34'),
(382, 369, NULL, NULL, NULL, 'JIHAN AFRILIZA', NULL, NULL, '27-01-2022', NULL, 'belum', 'belum', NULL, '2022-01-27 00:38:13', '2022-01-27 00:38:13'),
(383, 160, 'Online', 'SMP 1', NULL, 'Achmad Haikal Aunan Nasich', 'Reguler', 'Laki-laki', '27-01-2022', 600000, 'sudah registrasi', 'belum lunas', NULL, '2022-01-27 00:51:05', '2022-01-27 00:51:05'),
(384, 370, NULL, NULL, NULL, 'anisa nuri husniyah', NULL, NULL, '28-01-2022', NULL, 'belum', 'belum', NULL, '2022-01-28 00:21:45', '2022-01-28 00:21:45'),
(385, 370, 'Offline', 'MTs', NULL, 'anisa nuri husniyah', 'Reguler', 'Perempuan', '28-01-2022', 1600000, 'sudah registrasi', 'belum lunas', NULL, '2022-01-28 00:32:04', '2022-01-28 00:32:04'),
(386, 371, NULL, NULL, NULL, 'calya fitriani', NULL, NULL, '28-01-2022', NULL, 'belum', 'belum', NULL, '2022-01-28 00:39:00', '2022-01-28 00:39:00'),
(387, 372, NULL, NULL, NULL, 'muhammad khadiq mustofa', NULL, NULL, '28-01-2022', NULL, 'belum', 'belum', NULL, '2022-01-28 01:00:55', '2022-01-28 01:00:55'),
(388, 373, NULL, NULL, NULL, 'wildan malik nur rasyid', NULL, NULL, '28-01-2022', NULL, 'belum', 'belum', NULL, '2022-01-28 01:17:27', '2022-01-28 01:17:27'),
(389, 374, NULL, NULL, NULL, 'nabila syifa ramadhan', NULL, NULL, '28-01-2022', NULL, 'belum', 'belum', NULL, '2022-01-28 01:34:20', '2022-01-28 01:34:20'),
(390, 375, NULL, NULL, NULL, 'Ailsa Anindya Khairiyah', NULL, NULL, '28-01-2022', NULL, 'belum', 'belum', NULL, '2022-01-28 02:47:07', '2022-01-28 02:47:07'),
(391, 376, NULL, NULL, NULL, 'Ulfa najia', NULL, NULL, '28-01-2022', NULL, 'belum', 'belum', NULL, '2022-01-28 16:40:25', '2022-01-28 16:40:25'),
(392, 377, NULL, NULL, NULL, 'fika rahmawati', NULL, NULL, '29-01-2022', NULL, 'belum', 'belum', NULL, '2022-01-28 19:42:56', '2022-01-28 19:42:56'),
(393, 378, NULL, NULL, NULL, 'husna muflihah', NULL, NULL, '29-01-2022', NULL, 'belum', 'belum', NULL, '2022-01-28 19:47:39', '2022-01-28 19:47:39'),
(394, 379, NULL, NULL, NULL, 'fanya zulfa zahratuddini', NULL, NULL, '29-01-2022', NULL, 'belum', 'belum', NULL, '2022-01-28 19:52:02', '2022-01-28 19:52:02'),
(395, 380, NULL, NULL, NULL, 'khoir ramadhani', NULL, NULL, '29-01-2022', NULL, 'belum', 'belum', NULL, '2022-01-28 19:54:41', '2022-01-28 19:54:41'),
(396, 381, NULL, NULL, NULL, 'zulfa saniatur rosyidah', NULL, NULL, '29-01-2022', NULL, 'belum', 'belum', NULL, '2022-01-28 19:58:35', '2022-01-28 19:58:35'),
(397, 382, NULL, NULL, NULL, 'RAFIE BARRAN ADIYANA', NULL, NULL, '29-01-2022', NULL, 'belum', 'belum', NULL, '2022-01-28 20:03:25', '2022-01-28 20:03:25'),
(398, 383, NULL, NULL, NULL, 'nailafussyifa ulil faddillah', NULL, NULL, '29-01-2022', NULL, 'belum', 'belum', NULL, '2022-01-28 20:28:58', '2022-01-28 20:28:58'),
(399, 384, NULL, NULL, NULL, 'jauhar jelita pratiwi', NULL, NULL, '29-01-2022', NULL, 'belum', 'belum', NULL, '2022-01-28 20:41:10', '2022-01-28 20:41:10'),
